Title,Cook Time,Servings,Ingredients,Instructions,URL,ingredients_per_person
Cluster beans kara kuzhambu,,,"250 g cluster beans, 2 tbsp oil, 1 small lemon size tamarind, 1/4 tsp turmeric powder, 2 tbsp red chilli powder, 2 tbsp coriander powder, 1/2 cup coconut, 10 shallots, 1 tsp cumin seeds, 1 tbsp salt, 1 handful coriander leaves, 1 tsp mustard seeds, 1 sting curry leaves, 😋
6, ❤️
15, 👏
10, Paruppu Urandai Kuzhambu
Veggie Hotspot, Vendhaya kuzhambu
Abiya's Kitchen, Mor Kuzhambu
#reststyle - This is the South Indian version of Kadhi, a yoghurt-coconut based gravy, most popular in Tamil Nadu. Vegetables like pumpkin, okra, ash gourd, eggplant, chow chow, etc. are basically added to make it more healthy and nutritious. It is a very simple, easy to make and a yummy curry, best relished with plain steamed rice. Mor Kuzhambu is a common restaurant style dish served when ordering for a South Indian Thali.
Bethica Das, Cluster beans coconut stir fry /Gawar ki sabji/ kothamara thoran
This is a very easy and healthy recipe for including green vegetable like cluster beans in diet. Cluster beans in rich in nutrients, easy available in Indian markets and cost effective too. They otherwise is a little bitter for everyone s liking but adding coconut brings out a really good flavour. #greenveg
Vani Santhosh, Cluster beans
#goldenapron #post20
Simran Batra, Yogurt Cluster Beans
#greenveg #Post 2
NEETA BHARGAVA, Aloo Gauvar or cluster beans Dry sabzi
#mysterybox1
Deepti Patil, Cluster beans curry
#JR3 This is my mom receipe. Its too quick and as tasty. I love it 😋
Zarana Gandhi, Long Beans Stir Fry/ Payaru Poriyal/ Payar Mezhukkupuratti
An easy to make veggie stir fry, South Indian side dish… One of the side dishes that’s commonly served with South Indian lunch is a vegetarian stir fry in which any kind of veggies can be added. It can be either thoran or mezhukkupuratti. Only one kind of veggie is added or a combination of veggies are added. Thoran and mezhukkupuratti belong to the same category with slight variations. Usually, while making thoran grated coconut which is ground along with some seasonings is added to the veggies. While in mezhukkupuratti grated coconut is directly added to the veggies and is stir fried. Veggies like carrot, beans, beet root, cauliflower, cabbage can be used for making mezhukkupuratti. However, I like long beans mezhukkupuratti better than any other veggies. So, whenever I buy long beans, I make this stir fry. This goes well as a side dish along with rice or chapati.
SaranyaSenthil","250 g cluster beans | 2 tbsp oil | 1 small lemon size tamarind | 1/4 tsp turmeric powder | 2 tbsp red chilli powder | 2 tbsp coriander powder | 1/2 cup coconut | 10 shallots | 1 tsp cumin seeds | 1 tbsp salt | 1 handful coriander leaves | 1 tsp mustard seeds | 1 sting curry leaves | 1
First cluster beans wash and rinse well and cut into 2 inch pieces....Pour the oil into the pan and put the beans in it and fry well.. | 2
Once the beans are fried well, pour a little water with it and boil it well... | 3
Once the beans is well boiled, add the dissolved tamarind water, turmeric powder, chilli powder, coriander powder and boil it... | 4
Add salt cook 2 minutes.. Grind the coconut, onion and cumin in a mixer jar... | 5
Once the gravy boils well, add the grinding paste.When the gravy comes to thick and finally sprinkle the coriander leaves and turn off the stove... | 6
Once the oil has hot in a pan, add the mustard, curry leaves and add it to the gravy... | 7
Now ready to serve.. | Thai Coconut Pancakes | Cherry bakewell baked oats (vegan) | Hara Bhara Kabab- A veg party starter | Hot-Dogity Sauce | Crockpot Cinnamon Bun Casserole | The Best Chicken Parmesan | Baked Ziti | Easy Orzo Pasta Salad | Balsamic Chicken 🐔 Drumsticks 🍗 | Vietnamese Crab & White Asparagus Soup (súp măng cua) | Mayak Eggs | Baked Ziti | Vietnamese Crab & White Asparagus Soup (súp măng cua) | Black Rice 🦑 Paella with Garlic Mayonnaise!",https://cookpad.com/eng/recipes/24686615,"250 g cluster beans, 2 tbsp oil, 1 small lemon size tamarind, 1/4 tsp turmeric powder, 2 tbsp red chilli powder, 2 tbsp coriander powder, 1/2 cup coconut, 10 shallots, 1 tsp cumin seeds, 1 tbsp salt, 1 handful coriander leaves, 1 tsp mustard seeds, 1 sting curry leaves, 😋
6, ❤️
15, 👏
10, Paruppu Urandai Kuzhambu
Veggie Hotspot, Vendhaya kuzhambu
Abiya's Kitchen, Mor Kuzhambu
#reststyle - This is the South Indian version of Kadhi, a yoghurt-coconut based gravy, most popular in Tamil Nadu. Vegetables like pumpkin, okra, ash gourd, eggplant, chow chow, etc. are basically added to make it more healthy and nutritious. It is a very simple, easy to make and a yummy curry, best relished with plain steamed rice. Mor Kuzhambu is a common restaurant style dish served when ordering for a South Indian Thali.
Bethica Das, Cluster beans coconut stir fry /Gawar ki sabji/ kothamara thoran
This is a very easy and healthy recipe for including green vegetable like cluster beans in diet. Cluster beans in rich in nutrients, easy available in Indian markets and cost effective too. They otherwise is a little bitter for everyone s liking but adding coconut brings out a really good flavour. #greenveg
Vani Santhosh, Cluster beans
#goldenapron #post20
Simran Batra, Yogurt Cluster Beans
#greenveg #Post 2
NEETA BHARGAVA, Aloo Gauvar or cluster beans Dry sabzi
#mysterybox1
Deepti Patil, Cluster beans curry
#JR3 This is my mom receipe. Its too quick and as tasty. I love it 😋
Zarana Gandhi, Long Beans Stir Fry/ Payaru Poriyal/ Payar Mezhukkupuratti
An easy to make veggie stir fry, South Indian side dish… One of the side dishes that’s commonly served with South Indian lunch is a vegetarian stir fry in which any kind of veggies can be added. It can be either thoran or mezhukkupuratti. Only one kind of veggie is added or a combination of veggies are added. Thoran and mezhukkupuratti belong to the same category with slight variations. Usually, while making thoran grated coconut which is ground along with some seasonings is added to the veggies. While in mezhukkupuratti grated coconut is directly added to the veggies and is stir fried. Veggies like carrot, beans, beet root, cauliflower, cabbage can be used for making mezhukkupuratti. However, I like long beans mezhukkupuratti better than any other veggies. So, whenever I buy long beans, I make this stir fry. This goes well as a side dish along with rice or chapati.
SaranyaSenthil"
Rava upma with peanuts,,,"1 cup rava, 1 onion chopped, 3 green chillies chopped, Coriander leaves chopped, Few curry leaves, Oil, Red rava upma (goduma rava upma)
Its a famous southindian upma made with wheat rava which is dark brown in color and texture is just like normal idly rava. Same as sooji upma only difference is we need to add more water here as red rava is hard so to make is soft & fully cooked we need to add water as per the requirements. Oil requirement is more then sooji upma. Can add rosted cashews.
Shrajiv Kosanam, Rava upma
One of the many things to do with sooji(rava) is upma which is a healthy breakfast meal.Topped with veggies and peanuts its wholesome and rich in taste. #breakfast
shreyaas_world, Upma (for tiffen box)
When I get up late and have less time to make breakfast best option is upma
Madhu Mj, Easy Nutritious Sooji Upma
This is a quick, simple, easy to make Upma recipe with a slight difference from the usual upmas as this contains moong which is a protein rich sauce along with fiber. Optionally, you could add some vegetables such as tomato , carrot or capsicum (bell peppers) to add flavour and make it even more healthy.
Pallavi Pinge - Ambrosia Wellness, Ragi Dalia Upma
Yummy healthy modified version of rava Upma and a regular breakfast item at my place. Nutritionally, this is made from Ragi (or nachni) Dalia. It is rich in iron, calcium and fiber and tastes great!!
Pallavi Pinge - Ambrosia Wellness, Rice Rava Upma
#myrecipe Here is a very traditional way of having breakfast. This recipe reminds me of my grandmother's way of cooking. Very healthy and solid start of the day.
Srilakshmi, Upma😋
Nafeesa Mustafa, Railway train upma
It is memorable when we were travelling in train kerala express we always got this upma and relish the taste of it my husband likes this rather than south Indian upma with coconut and all
Rita Mehta ( Executive chef ), Sabudana upma
Breakfast recipe
Joy Of Cooking","1 cup rava | 1 onion chopped | 3 green chillies chopped | Coriander leaves chopped | Few curry leaves | Oil | 1
Roast rava till light brown and keep aside. | 2
Heat a pan add oil and peanuts.Onion, chilli, curry leaves.Saute till cooked. | 3
Add roasted rava, salt.Saute for two minutes.Now add triple warm water and cook till water absorbs. | 4
Mix well.Serve upma with coriander leaves,shev and any pickle or lemon. | Thai Coconut Pancakes | Cherry bakewell baked oats (vegan) | Hara Bhara Kabab- A veg party starter | Hot-Dogity Sauce | Crockpot Cinnamon Bun Casserole | Hawaiian Loco Moco | Butter Masala Pasta | Pasta Primavera | Hotdog ""Empanadas"" 🌭 | Somali Rice (Bariis) | Apple Pie Cake with Cinnamon-Infused Cream Cheese Icing | California Farm Beef Liver Broth Cubes and Dumplings | Easy lunch! Japanese-style pizza with whitebait, chikuwa and leeks | Air Fryer Savoy Cabbage 🥬",https://cookpad.com/eng/recipes/24772915,"1 cup rava, 1 onion chopped, 3 green chillies chopped, Coriander leaves chopped, Few curry leaves, Oil, Red rava upma (goduma rava upma)
Its a famous southindian upma made with wheat rava which is dark brown in color and texture is just like normal idly rava. Same as sooji upma only difference is we need to add more water here as red rava is hard so to make is soft & fully cooked we need to add water as per the requirements. Oil requirement is more then sooji upma. Can add rosted cashews.
Shrajiv Kosanam, Rava upma
One of the many things to do with sooji(rava) is upma which is a healthy breakfast meal.Topped with veggies and peanuts its wholesome and rich in taste. #breakfast
shreyaas_world, Upma (for tiffen box)
When I get up late and have less time to make breakfast best option is upma
Madhu Mj, Easy Nutritious Sooji Upma
This is a quick, simple, easy to make Upma recipe with a slight difference from the usual upmas as this contains moong which is a protein rich sauce along with fiber. Optionally, you could add some vegetables such as tomato , carrot or capsicum (bell peppers) to add flavour and make it even more healthy.
Pallavi Pinge - Ambrosia Wellness, Ragi Dalia Upma
Yummy healthy modified version of rava Upma and a regular breakfast item at my place. Nutritionally, this is made from Ragi (or nachni) Dalia. It is rich in iron, calcium and fiber and tastes great!!
Pallavi Pinge - Ambrosia Wellness, Rice Rava Upma
#myrecipe Here is a very traditional way of having breakfast. This recipe reminds me of my grandmother's way of cooking. Very healthy and solid start of the day.
Srilakshmi, Upma😋
Nafeesa Mustafa, Railway train upma
It is memorable when we were travelling in train kerala express we always got this upma and relish the taste of it my husband likes this rather than south Indian upma with coconut and all
Rita Mehta ( Executive chef ), Sabudana upma
Breakfast recipe
Joy Of Cooking"
Upma😋,,,"1 cup rava, 1/4 cup peanuts, 1 tsp jeera, 1 tsp mustard seeds, 1 tsp urad dal, 1 big chopped onion, 3-4 green chillies, Salt, Tomato, 1 tbspn curd, 1 bunch coriander leaves, Oil, Lemon, Red chilli powdr(only if needed), 1 cup water, 😋
2, ❤️
4, Upma
#Tiffin
Kannu Arora, Upma
Spurthi Rao, Upma
#mysterybox3
Kusum Agarwal, Simple upma
Easy and quick recipe
shravani j, Tomato upma
#goldenapron Week 18
Nikita Singhal, Upma Pesarattu
Upma Pesarattu is a very famous breakfast dish of Andhra Pradesh. The combination of Upma with Pesarattu (Dosa made with green moong dal) goes perfectly together, and with a side of ginger / onion chutney, it is a heat, just like Poori-Halwa or Khara Baath-Kesari Bath. Upma Pesarattu is one such thing, which I really enjoy in my breakfast. This is full of  proteins  and nutrients and makes a good power packed breakfast. It is very filling so you wont really feel hungry soon. Although the process looks quite lengthy, believe me it doesn't take very long if you do all the preparations before hand (like :- soak the dals the previous night, making some chutney and keep it in the fridge). Also this is my entry for the contest conducted by #ReshKitchen
Pawani Mutturu, Peas upma
Peas upma
shravani j, Bread upma
Easy to make bread upma. Filling breakfast to keep you going 😊
Samantha Noronha 1995, Upma with dahi handi
#CookClick #losingweight
Deepika Pushkar Sinha _______#DDV😘","1 cup rava | 1/4 cup peanuts | 1 tsp jeera | 1 tsp mustard seeds | 1 tsp urad dal | 1 big chopped onion | 3-4 green chillies | Salt | Tomato | 1 tbspn curd | 1 bunch coriander leaves | Oil | Lemon | Red chilli powdr(only if needed) | 1 cup water | 1
Rost the rava in a nonstick pan for a while.till its crispy,remove it in a plate keep aside! Roast the peanut in little oil for a while and remove it in a bowl! | 2
In a same pan add little oil,add jeera, mustard seeds, urad daal roast it for a while add chopped onions saute well..add green chlies,tomatoes,salt mix well,add curd keepon stiring it,add little water and cook for a while! Now add the roasted rava and quickly mix it well! Add red chilli powder(if needed) add the roasted peanuts and some coriander leaves mix it well🤩take out in a plate garnish it with some thin sev,lemon and coriander leaves! Ready😋 | Thai Coconut Pancakes | Cherry bakewell baked oats (vegan) | Hara Bhara Kabab- A veg party starter | Hot-Dogity Sauce | Crockpot Cinnamon Bun Casserole | Easy homemade burgers! | 薑檸豬肉 (Ginger Lemon Pork) | Restaurant style Paneer Makhani | Tortilla Nachos | Coco Sugar Fried Saba : Banana Caramel : Banana Cue (dessert / snack) | Banana Bread Easy Peasy | Bread Pudding (For leftover breads) | Easy Mayonnaise Salad Lunch | Rainbow Vegetables Rolls with Peanut Sriracha Dipping Sauce",https://cookpad.com/eng/recipes/12405760,"1 cup rava, 1/4 cup peanuts, 1 tsp jeera, 1 tsp mustard seeds, 1 tsp urad dal, 1 big chopped onion, 3-4 green chillies, Salt, Tomato, 1 tbspn curd, 1 bunch coriander leaves, Oil, Lemon, Red chilli powdr(only if needed), 1 cup water, 😋
2, ❤️
4, Upma
#Tiffin
Kannu Arora, Upma
Spurthi Rao, Upma
#mysterybox3
Kusum Agarwal, Simple upma
Easy and quick recipe
shravani j, Tomato upma
#goldenapron Week 18
Nikita Singhal, Upma Pesarattu
Upma Pesarattu is a very famous breakfast dish of Andhra Pradesh. The combination of Upma with Pesarattu (Dosa made with green moong dal) goes perfectly together, and with a side of ginger / onion chutney, it is a heat, just like Poori-Halwa or Khara Baath-Kesari Bath. Upma Pesarattu is one such thing, which I really enjoy in my breakfast. This is full of  proteins  and nutrients and makes a good power packed breakfast. It is very filling so you wont really feel hungry soon. Although the process looks quite lengthy, believe me it doesn't take very long if you do all the preparations before hand (like :- soak the dals the previous night, making some chutney and keep it in the fridge). Also this is my entry for the contest conducted by #ReshKitchen
Pawani Mutturu, Peas upma
Peas upma
shravani j, Bread upma
Easy to make bread upma. Filling breakfast to keep you going 😊
Samantha Noronha 1995, Upma with dahi handi
#CookClick #losingweight
Deepika Pushkar Sinha _______#DDV😘"
"Tamilnadu Thali - rice, sambar, mor kuzhambu, beetroot poriyal, payasam, buttermilk for lunch",,,"For rice, 3 cups rajabogam rice, 6 cups water, For sambar:, 1/2 cup yellow pigeon pea, 1 tomato, 1 small lemon size tamarind, 4 drumstick, 4 tbsp sambar powder, 2 tbsp coconut, 3 shallots, 1/4 tsp cumin seeds, 2 garlic cloves, 1 handful coriander leaves, 1 tbsp oil, 1 tsp mustard seeds, 1/4 tsp hing, 1 sting curry leaves, 1/2 cup shallots, For ladies finger mor kuzhambu:, 1 tbsp yellow pigeon pea, 1 tbsp raw rice, 1 cup curd, 250 g ladies finger, 1 tsp oil, 1/2 cup coconut, 5 green chilies, 1 tsp cumin seeds, 10 shallots, 1 tbsp oil, 1 tsp mustard seeds, 2 dry red chillies, 3 onion vadagam, 1/2 tsp turmeric powder, 2 tbsp chopped coriander leaves, 😋
12, ❤️
24, 👏
16, Sambar rice
#GA4 #week7 #khichdi
Pradnya Khadpekar, Mor Kuzhambu
#reststyle - This is the South Indian version of Kadhi, a yoghurt-coconut based gravy, most popular in Tamil Nadu. Vegetables like pumpkin, okra, ash gourd, eggplant, chow chow, etc. are basically added to make it more healthy and nutritious. It is a very simple, easy to make and a yummy curry, best relished with plain steamed rice. Mor Kuzhambu is a common restaurant style dish served when ordering for a South Indian Thali.
Bethica Das, Drumstick Sambar (Without sambar powder)
Prasel, Idli-sambar
Rekha Jangid, Kerala sambar
Enjoy
salima shafeeq, Beans Sambar
Prasel, Masala Dosa Sambar
Masala dosa is a South Indian recipe served with sambar, coconut chutney, and onion chutney. It is loved by both children and adults.
Meenakshi Bansal
Translated from Cookpad India, Sambar recipe
Saili, Sambar
It's so yummy
clouds view","For rice | 3 cups rajabogam rice | 6 cups water | For sambar: | 1/2 cup yellow pigeon pea | 1 tomato | 1 small lemon size tamarind | 4 drumstick | 4 tbsp sambar powder | 2 tbsp coconut | 3 shallots | 1/4 tsp cumin seeds | 2 garlic cloves | 1 handful coriander leaves | 1 tbsp oil | 1 tsp mustard seeds | 1/4 tsp hing | 1 sting curry leaves | 1/2 cup shallots | For ladies finger mor kuzhambu: | 1 tbsp yellow pigeon pea | 1 tbsp raw rice | 1 cup curd | 250 g ladies finger | 1 tsp oil | 1/2 cup coconut | 5 green chilies | 1 tsp cumin seeds | 10 shallots | 1 tbsp oil | 1 tsp mustard seeds | 2 dry red chillies | 3 onion vadagam | 1/2 tsp turmeric powder | 2 tbsp chopped coriander leaves | 1
Wash the rice well, add it to the cooker, pour water, close the cooker and let it cook for 3 whistles, then the rice is ready.... | 2 | 3
Wash the lentils well, pour the required amount of water in the cooker, close the cooker and cook for 3 whistles... Chop the drumstick as shown in the picture.... | 4
Soak the tamarind and let it dissolve... | 5
Once the lentils are cooked, transfer them to another vessel, add chopped drumstick, chopped tomato, turmeric powder, water and let it boil until the vegetables are cooked. | 6
Add the dissolved tamarind, salt, and sambar powder and mix well. | 7
I have given the link below for the recipe description of sambar powder...
Sambar masala powder | 8
While the gravy is boiling, grind the coconut, onion, cumin seeds, and garlic in a mixer jar with a little water, add to the sambar, and let it boil for 2 minutes. | 9
Once the sambar is cooked, finally sprinkle coriander leaves mix well... | 10
Heat oil in a wok add mustard, curry leaves, asafoetida saute well add it to the sambar. Heat a little oil in the pan and fry the onion well and add it to the sambar. | 11 | 12
For mor kuzhambu... Soak the dal and rice for 30 minutes... Take a bowl add curd whisk well making sure to have a silky smooth consistency. keep aside. | 13
Wash and dry the ladies finger on a towel. Drying them will remove the excess moisture and help in faster browning while cooking. Snap off the ends of the ladies finger. Cut into 1 inch pieces. Set aside. Add a teaspoon of oil to a pan and add in the ladies finger. Wider the pan – the better, as it will have more surface area and the ladies finger will brown faster and better without being slimy. Saute on a low flame. Once the ladies finger is cooked, remove from heat and set aside. | 14
In a mixer jar, combine lentils, rice, green chilies, and water, grind well, and add to curd... | 15
In the same jar, grind coconut, onion, cumin seeds, add yogurt and mix with required amount of water. adjust the consistency as required adding water if required. | 16
Add salt, turmeric powder, coriander leaves and mix it and keep it in the stove... | 17
Boil the mor kuzhambu on low flame till it turns just frothy. further, add in fried ladies finger and give a good mix. | 18
Heat oil in a pan and add in the urad dal and mustard seeds. Let the mustard seeds crackle. Add red chilli, curry leaves, onion vadagam saute well... Add this prepared tempering to the curry and mix it well. Now ready to serve | 19
I have given the link for the buttermilk recipe below..
Neer mor | 20
I have given the link for the beetroot poriyal recipe below.
Beetroot poriyal | 21
I have given the link for the Payasam recipe explanation below....
Sago kheer | 22
Now ready Tamilnadu Thali for lunch... | 23
Mix everything well... Sambar is ready... | Thai Coconut Pancakes | Cherry bakewell baked oats (vegan) | Hara Bhara Kabab- A veg party starter | Hot-Dogity Sauce | Crockpot Cinnamon Bun Casserole | Minty Watermelon Gond Katira Lemonade Fizz | Sweet and Savory Strawberry Mozzarella Pie | Italian Sausage in White Wine Sauce | 90 second Bread | California Farm 1 Chicken 1 Lemon Roast | California Farm Panfried Summer Squash | Tomato Relish | Pumpkin Dahl | 90 second Bread",https://cookpad.com/eng/recipes/24909366,"For rice, 3 cups rajabogam rice, 6 cups water, For sambar:, 1/2 cup yellow pigeon pea, 1 tomato, 1 small lemon size tamarind, 4 drumstick, 4 tbsp sambar powder, 2 tbsp coconut, 3 shallots, 1/4 tsp cumin seeds, 2 garlic cloves, 1 handful coriander leaves, 1 tbsp oil, 1 tsp mustard seeds, 1/4 tsp hing, 1 sting curry leaves, 1/2 cup shallots, For ladies finger mor kuzhambu:, 1 tbsp yellow pigeon pea, 1 tbsp raw rice, 1 cup curd, 250 g ladies finger, 1 tsp oil, 1/2 cup coconut, 5 green chilies, 1 tsp cumin seeds, 10 shallots, 1 tbsp oil, 1 tsp mustard seeds, 2 dry red chillies, 3 onion vadagam, 1/2 tsp turmeric powder, 2 tbsp chopped coriander leaves, 😋
12, ❤️
24, 👏
16, Sambar rice
#GA4 #week7 #khichdi
Pradnya Khadpekar, Mor Kuzhambu
#reststyle - This is the South Indian version of Kadhi, a yoghurt-coconut based gravy, most popular in Tamil Nadu. Vegetables like pumpkin, okra, ash gourd, eggplant, chow chow, etc. are basically added to make it more healthy and nutritious. It is a very simple, easy to make and a yummy curry, best relished with plain steamed rice. Mor Kuzhambu is a common restaurant style dish served when ordering for a South Indian Thali.
Bethica Das, Drumstick Sambar (Without sambar powder)
Prasel, Idli-sambar
Rekha Jangid, Kerala sambar
Enjoy
salima shafeeq, Beans Sambar
Prasel, Masala Dosa Sambar
Masala dosa is a South Indian recipe served with sambar, coconut chutney, and onion chutney. It is loved by both children and adults.
Meenakshi Bansal
Translated from Cookpad India, Sambar recipe
Saili, Sambar
It's so yummy
clouds view"
