Title,Cook Time,Servings,Ingredients,Instructions,URL,ingredients_per_person
String hopper/ Idiyappam,,,"2 cups string hopper flour, 11/2 cups water, 1 tsp salt, 1 tsp oil, 😋
9, ❤️
21, 👏
8, Idiyappam
#colourwhite
Rohini Rathi, Kerala idiyappam recipe| nool puttu or sevai with rice flour
Idiyappam or string hoppers are popular South Indian breakfast dish made of very few ingredients like rice flour and water. In Kerala, these are usually served with vegetable stew. In some parts of Kerala, these are called nool puttu, while in Tamil Nadu, sevai is a popular breakfast dish. I’ll give you plenty of tips and tricks to make your family go ‘wow’. Ok, let’s do this. Start with the number one tip. 1. Use good quality rice flour If you really want to make idiyappams that taste great, you need to buy good quality rice flour. Classic idiyappam recipes call for raw rice flour. And that’s exactly why you must visit your local Indian grocery store. Raw rice flour is totally different from the regular rice flour you buy from other grocery stores. 2. Roast the flour Roasted rice flour is readily available from Indian chops. Look for “idiyappam podi, appam podi” etc. If you can’t find roasted rice flour for your idiyappam recipe, buy regular rice flour and roast it at home. All you need to do is lightly fry it over low flame. Don’t forget to stir continuously. 3. Use boiling water It is important to allow the water to come to a boil before adding it to rice flour. Warm water is not enough if you want soft and delicious idiyappam. 4. Don’t let dough cool completely Well, this is obviously a very important tip. While you’re pressing the idiyappam, the dough needs to be slightly warm. That way, idiyappam remains soft and holds it's shape really well.
SaranyaSenthil, Idiyappam
#5ing
Ilavarasi Vetri Venthan, Idiyappam Urad Dal Pakora
#deepfried - This can be a perfect party appetizer. Made from some leftover Idiyappam (string hoppers) and ground urad dal. My first try and they came out absolutely yummy. So go ahead and give it a try and surprise your loved ones. Serve along with tomato sauce, green chutney, mayo or hummus. They can also be relished as a side dish with dal chawal, curd rice or sambar rice.
Bethica Das, Quesadillas with String Cheese😋
Hello my beautiful people, how are you? Are you ready for a super quick and delicious recipe? 😋
Mar Tapia
Translated from Cookpad Mexico, String cheese slices
Nolan Comee, String Beans
Meme, String Beans Adobo
Cooking something for dinner ❣️
Shy Casi, String Beans
Meme","2 cups string hopper flour | 11/2 cups water | 1 tsp salt | 1 tsp oil | 1
First, add the teaspoon of oil to the water and bring it to a rolling boil. Once the water starts to boil, turn off the flame. | 2
In a separate mixing bowl, add the idiyappam flour, salt and mix well. Add about ¾ Cup of the hot water to the rice flour. Stir with a spatula. Now, continue to add the water little by little to the rice flour and mix well until a soft, smooth and non-sticky dough is formed. | 3
Once you are able to handle the dough by hand, knead it nicely for 1-2 mins. Grease the inside portion of the idiyappam press. Grease your palm with oil, take a portion of the dough, smoothen it out in your palm and fill it in the press. Similarly, grease the steamer plate. Gently press the idiyappam dough in a circular motion onto the steamer plate, as shown in the pic. | 4 | 5
Steam the idiyappam for about 5 mins, until cooked through. Let the idiyapam to cool down a bit, before gently removing from the steamer plate and transferring to a serving plate. | 6 | 7
Enjoy hot with a side of spicy kurma or sweetened coconut milk. | Thai Coconut Pancakes | Cherry bakewell baked oats (vegan) | Hara Bhara Kabab- A veg party starter | Hot-Dogity Sauce | Crockpot Cinnamon Bun Casserole | Potatoes, au gratin ￼ | Gringos Charro Beans 🫘 | California Farm Lamb Biryani | California Farm Light Mango Margeritas",https://cookpad.com/eng/recipes/23842945,"2 cups string hopper flour, 11/2 cups water, 1 tsp salt, 1 tsp oil, 😋
9, ❤️
21, 👏
8, Idiyappam
#colourwhite
Rohini Rathi, Kerala idiyappam recipe| nool puttu or sevai with rice flour
Idiyappam or string hoppers are popular South Indian breakfast dish made of very few ingredients like rice flour and water. In Kerala, these are usually served with vegetable stew. In some parts of Kerala, these are called nool puttu, while in Tamil Nadu, sevai is a popular breakfast dish. I’ll give you plenty of tips and tricks to make your family go ‘wow’. Ok, let’s do this. Start with the number one tip. 1. Use good quality rice flour If you really want to make idiyappams that taste great, you need to buy good quality rice flour. Classic idiyappam recipes call for raw rice flour. And that’s exactly why you must visit your local Indian grocery store. Raw rice flour is totally different from the regular rice flour you buy from other grocery stores. 2. Roast the flour Roasted rice flour is readily available from Indian chops. Look for “idiyappam podi, appam podi” etc. If you can’t find roasted rice flour for your idiyappam recipe, buy regular rice flour and roast it at home. All you need to do is lightly fry it over low flame. Don’t forget to stir continuously. 3. Use boiling water It is important to allow the water to come to a boil before adding it to rice flour. Warm water is not enough if you want soft and delicious idiyappam. 4. Don’t let dough cool completely Well, this is obviously a very important tip. While you’re pressing the idiyappam, the dough needs to be slightly warm. That way, idiyappam remains soft and holds it's shape really well.
SaranyaSenthil, Idiyappam
#5ing
Ilavarasi Vetri Venthan, Idiyappam Urad Dal Pakora
#deepfried - This can be a perfect party appetizer. Made from some leftover Idiyappam (string hoppers) and ground urad dal. My first try and they came out absolutely yummy. So go ahead and give it a try and surprise your loved ones. Serve along with tomato sauce, green chutney, mayo or hummus. They can also be relished as a side dish with dal chawal, curd rice or sambar rice.
Bethica Das, Quesadillas with String Cheese😋
Hello my beautiful people, how are you? Are you ready for a super quick and delicious recipe? 😋
Mar Tapia
Translated from Cookpad Mexico, String cheese slices
Nolan Comee, String Beans
Meme, String Beans Adobo
Cooking something for dinner ❣️
Shy Casi, String Beans
Meme"
Idly Sambar Without Veggies| Homemade Sambar | Lentil Recipe |Toor Dal (Pigeon Peas) Sambar Recipe,,,"1 Tomato, 10-15 Shallots / Small Onions, 125 ml or 1/2 cup Toor Dal / Pigeon pea / Arhar Dal / Thuvaram paruppu, 2 tablespoon Sambar Powder, 1/2 tablespoon Turmeric Powder, 1/2 tablespoon Turmeric Powder, Pinch Salt, To Temper:, 5 tablespoons Cooking oil (Peanut oil), 1 spring of Curry leaves, 1 teaspoon Mustard Seeds, 1-2 Red chilli, 😋
3, ❤️
4, 👏
2, Healthy IDLI SAMBAR😋
Lets stay healthy with so nutritious and yumm healthy brunch.and one special thing I didn't have idli stand so I used small steel bowls it was so easy and tricky. #mommasrecipes
Passi Vikshali, Idli-sambar
Rekha Jangid, Sambar
South Indian lentil-based vegetable stew in a tamarind broth.
Bobby, Masala Dosa Sambar
Masala dosa is a South Indian recipe served with sambar, coconut chutney, and onion chutney. It is loved by both children and adults.
Meenakshi Bansal
Translated from Cookpad India, Tiffin Sambar:
Tiffin usually depicts south Indian breakfast. Normally Idli, Dosa, Pongal. This particular sambar is very good combination with Idlies or dosas as well as goes very well with mini idlies which normally known or served as 14 idlies, mini idlies or button idlies at restaurants. In this sambar, we don’t use any coconut and basically a seasoned mixed dhal with sambar powder as well as baby onions, tomatoes and with or without drumstick pieces. #reststyle #goldenapron 16th recipe Date: 19th June 2019
Shrikripa, Tiffin sambar
Rama, Sambar (easy and quick recipe)
Very easy way to prepare sambar at home without tamarind and jagerry. #india #book #ebook
Homecook Mou, Winter Special Turicha Sambar with Idli (Fresh pigeon peas)
#cookpad #cookpadindia This is a perfect winter breakfast loaded with fresh vegetables available during winter
Manisha Malvi Angaitkar, Onam Vibhavangal-Sambar'
Sambar is a very common side dish in our diets and is used widely for all occasions. Making a mouth watering sambar needs a special art. I always add some leaves like spinach or the leaves of Ivy gourd or Koval for making the sambar more rich in taste.I Ialso use my own home- made sambar powder for making it really delicious
JollyAbraham","1 Tomato | 10-15 Shallots / Small Onions | 125 ml or 1/2 cup Toor Dal / Pigeon pea / Arhar Dal / Thuvaram paruppu | 2 tablespoon Sambar Powder | 1/2 tablespoon Turmeric Powder | 1/2 tablespoon Turmeric Powder | Pinch Salt | To Temper: | 5 tablespoons Cooking oil (Peanut oil) | 1 spring of Curry leaves | 1 teaspoon Mustard Seeds | 1-2 Red chilli | 1
Soak tamarind in warm or hot water for 15 minutes. | 2
Squeeze and extract thick pulp, discard the peels and Keep aside. | 3
Wash the toor dal under running water for few times, soak into 2 to 3 glass of water. | 4
Now, Add chopped tomatoes. | 5
Pressure cook on medium flame on 4 to 5 whistles. | 6
Once the Pressure is released, Mash the dal with ladle or spoon until it become very smooth. | 7
Add turmeric and Sambar Powder. | 8
Pour Tamarind Pulp & mix it well. | 9
Add 10 to 15 Shallots, Pinch of Salt. | 10
And then, add 1 or 2 glass of water & mix it well. | 11
Close the lid and Pressure cook on medium flame on 1 or 2 whistle. | 12
Once the Pressure is released, open the lid and keep aside. | 13
To temper, add 5 spoons of cooking oil on pan. Add Mustard seeds, | 14
When it splutter add curry leaves and red chilli, | 15
1 tbsp of sambar powder.Add Asafoetida (Hing) Perungayam Optional only. | 16
Now, pour the tempering to the hot sambar. | 17
Finally Hot Sambar is ready to serve with Hot idlis. | Thai Coconut Pancakes | Cherry bakewell baked oats (vegan) | Hara Bhara Kabab- A veg party starter | Hot-Dogity Sauce | Crockpot Cinnamon Bun Casserole | Moroccan Lentil and Eggplant Soup | Corned Beef Bread Pie | Crispy Cheesy Tuna Pie | Egg Salad Bread Roll | California Farm Whole Pork Loin | Pizza Bread Roll | Moroccan Lentil and Eggplant Soup | California Farm Whole Pork Loin | Crispy Cheesy Tuna Pie",https://cookpad.com/eng/recipes/23962113,"1 Tomato, 10-15 Shallots / Small Onions, 125 ml or 1/2 cup Toor Dal / Pigeon pea / Arhar Dal / Thuvaram paruppu, 2 tablespoon Sambar Powder, 1/2 tablespoon Turmeric Powder, 1/2 tablespoon Turmeric Powder, Pinch Salt, To Temper:, 5 tablespoons Cooking oil (Peanut oil), 1 spring of Curry leaves, 1 teaspoon Mustard Seeds, 1-2 Red chilli, 😋
3, ❤️
4, 👏
2, Healthy IDLI SAMBAR😋
Lets stay healthy with so nutritious and yumm healthy brunch.and one special thing I didn't have idli stand so I used small steel bowls it was so easy and tricky. #mommasrecipes
Passi Vikshali, Idli-sambar
Rekha Jangid, Sambar
South Indian lentil-based vegetable stew in a tamarind broth.
Bobby, Masala Dosa Sambar
Masala dosa is a South Indian recipe served with sambar, coconut chutney, and onion chutney. It is loved by both children and adults.
Meenakshi Bansal
Translated from Cookpad India, Tiffin Sambar:
Tiffin usually depicts south Indian breakfast. Normally Idli, Dosa, Pongal. This particular sambar is very good combination with Idlies or dosas as well as goes very well with mini idlies which normally known or served as 14 idlies, mini idlies or button idlies at restaurants. In this sambar, we don’t use any coconut and basically a seasoned mixed dhal with sambar powder as well as baby onions, tomatoes and with or without drumstick pieces. #reststyle #goldenapron 16th recipe Date: 19th June 2019
Shrikripa, Tiffin sambar
Rama, Sambar (easy and quick recipe)
Very easy way to prepare sambar at home without tamarind and jagerry. #india #book #ebook
Homecook Mou, Winter Special Turicha Sambar with Idli (Fresh pigeon peas)
#cookpad #cookpadindia This is a perfect winter breakfast loaded with fresh vegetables available during winter
Manisha Malvi Angaitkar, Onam Vibhavangal-Sambar'
Sambar is a very common side dish in our diets and is used widely for all occasions. Making a mouth watering sambar needs a special art. I always add some leaves like spinach or the leaves of Ivy gourd or Koval for making the sambar more rich in taste.I Ialso use my own home- made sambar powder for making it really delicious
JollyAbraham"
Vermicelli upma,,,"1 bowl wheat vermicelli, 1 onion, 1 Tomato, Half cup green peas, Half teaspoon thermal powder, 1 teaspoon red chilli powder, 5-6 Curry leaves, 2 tablespoon ghee, 2 tablespoon chopped coriander, 1 tablespoon sugar, 1/2 teaspoon salt, 😋
2, ❤️
7, 👏
1, Vermicelli upma
I use to make it for my family as snacks and they love it..
sakshipriya.sp, Vermicelli upma
#GA4 #week5 #Upma
Pradnya Khadpekar, Peas upma
Peas upma
shravani j, Broken Wheat upma | Dalia upma
A healthy and tasty recipe made from broken wheat . Nutritionally its an alternate for traditional sooji upma. We can have it anytime since its easy to digest.
JustFood, Tomato Vermicelli Upma
#rss #post_no13
RUCHIKA, Vermicelli Upma
Durayya, Bread upma
Easy to make bread upma. Filling breakfast to keep you going 😊
Samantha Noronha 1995, Shavige upma (vermicelli upma)
Healthy and easy recipe . #savory
Spurthi Rao, Bread Upma
This is one of the best breakfast recipe Iove to make in the mornings. Moreover sprinkling sev on upma makes it little crunchy and more tasty.
hirdhanshu tyagi","1 bowl wheat vermicelli | 1 onion | 1 Tomato | Half cup green peas | Half teaspoon thermal powder | 1 teaspoon red chilli powder | 5-6 Curry leaves | 2 tablespoon ghee | 2 tablespoon chopped coriander | 1 tablespoon sugar | 1/2 teaspoon salt | 1
First of all roast wheat vermicelli in ghee. After roasting remove it in plate and then add oil in the pan | 2
Then make a tadka with mustard seeds cumin seeds and curry leaves then and chopped onion and stir it till onion become transparent. Afterward s add green peas chopped tomato in it soute it add all spices which mention in list. | 3
Now and water and boil it after boiling add rosted vermicelli in it mix it well and keep plate on it | 4
After 3 -4 minutes open that plate and add chopped coriander and mix it well. Your vermicelli upma is ready | Thai Coconut Pancakes | Cherry bakewell baked oats (vegan) | Hara Bhara Kabab- A veg party starter | Hot-Dogity Sauce | Crockpot Cinnamon Bun Casserole | Peach Upside Down Cake 🍑 | Baked Spaghetti | Bismarck | Instant pot southern chicken and rice | Peach Upside Down Cake 🍑 | Bismarck | Baked Spaghetti",https://cookpad.com/eng/recipes/16404190,"1 bowl wheat vermicelli, 1 onion, 1 Tomato, Half cup green peas, Half teaspoon thermal powder, 1 teaspoon red chilli powder, 5-6 Curry leaves, 2 tablespoon ghee, 2 tablespoon chopped coriander, 1 tablespoon sugar, 1/2 teaspoon salt, 😋
2, ❤️
7, 👏
1, Vermicelli upma
I use to make it for my family as snacks and they love it..
sakshipriya.sp, Vermicelli upma
#GA4 #week5 #Upma
Pradnya Khadpekar, Peas upma
Peas upma
shravani j, Broken Wheat upma | Dalia upma
A healthy and tasty recipe made from broken wheat . Nutritionally its an alternate for traditional sooji upma. We can have it anytime since its easy to digest.
JustFood, Tomato Vermicelli Upma
#rss #post_no13
RUCHIKA, Vermicelli Upma
Durayya, Bread upma
Easy to make bread upma. Filling breakfast to keep you going 😊
Samantha Noronha 1995, Shavige upma (vermicelli upma)
Healthy and easy recipe . #savory
Spurthi Rao, Bread Upma
This is one of the best breakfast recipe Iove to make in the mornings. Moreover sprinkling sev on upma makes it little crunchy and more tasty.
hirdhanshu tyagi"
Tamarind rice(Leftover rice),,,"2 cups cooked rice, 1/4 easpoon salt, 1/4 teaspoon turmeric powder, 1 tablespoon ghee, Spice powder for tamarind rice, 4 dry red chillies, 2 teaspoons coriander seeds, 1 teaspoon chana dal, 1 teaspoon urad dal, 1/4 teaspoon methi seeds, 1/2 teaspoon black pepper, 1/2 teaspoon sesame seeds, 1/2 teaspoon hing, Tamarind pulp, 50 grams tamarind, 2 cup hot water, Tempering and other ingredients for tamarind rice, 3 tablespoons oil, 1/4 cup peanuts, 1/4 teaspoon turmeric powder, 1/2 teaspoon hing, 1 sprig curry leaves, 2-3 dry red chillies, 1/2 teaspoon salt, 2 teaspoons jaggery powder, 😋
2, ❤️
8, 👏
4, Tamarind rice
One of the best, delicious South Indian rice preparations. It has tangy/sour, spicy taste.
Coco, Mango rice
#favcuisine
Sabina Tabassum, Lemon Rice with leftover rice
#goldenapron3 Clue used- rice, leftover #DC #postno7 Jhatpat recipe #icookathome #quarantinelife
RUCHIKA, Lemon rice with coconut chutney
#colouryellow Lemon rice with coconut chutney south is very famous
Karuna Naveen Chandwani, Mango Rice
Mango rice is a famous south indian food which is made by using raw mango, steamed rice and some simple ingredients. It is absolutely delicious. It is very easy to make yet very tasty. One can make this simple tangy flavoured rice preparation by following some simple steps. #riceisthebest
Joyeta Biswas, Mango rice
#favourite
Rohini Gupta, Coconut Rice
#mysterybox 3 #Cashews
Rakhee Rathi, Rice (அரிசி) upma
This is a very fragrant recipe complete with carbs, packed with protein and a splash of essential fat and digestive herbs to keep your tummy healthy! What's more? Completely vegan and very delicious too!😋😋
Lakshmi Balaji, Raw Mango Rice
Have you ever tried Mango rice?? If not, then give your boring rice a makeover with this lovely recipe. I was scrolling through YouTube and there I came across this lovely recipe which includes unripe mangoes (kacha aam) to give a healthy twist to our regular rice. We, here in the North, do not relish rice this way, so it was pretty new flavour for my family. The raw mango gives tangy taste to the rice whereas assorted dals and peanuts give it a crunch, a tantalizing aroma and interesting mouth feel. You can savour it with side dishes like ginger chutney or curd. But I devoured this as it is, enjoying every bite and feeling every single flavour. Yummmm! #khana
Vertika Tyagi","2 cups cooked rice | 1/4 easpoon salt | 1/4 teaspoon turmeric powder | 1 tablespoon ghee | Spice powder for tamarind rice | 4 dry red chillies | 2 teaspoons coriander seeds | 1 teaspoon chana dal | 1 teaspoon urad dal | 1/4 teaspoon methi seeds | 1/2 teaspoon black pepper | 1/2 teaspoon sesame seeds | 1/2 teaspoon hing | Tamarind pulp | 50 grams tamarind | 2 cup hot water | Tempering and other ingredients for tamarind rice | 3 tablespoons oil | 1/4 cup peanuts | 1/4 teaspoon turmeric powder | 1/2 teaspoon hing | 1 sprig curry leaves | 2-3 dry red chillies | 1/2 teaspoon salt | 2 teaspoons jaggery powder | 1
Take pan and dry roast all spices and let it cool and grind into powder | 2
Take out the tamarind pulp | 3
Take the kadai put grinded spices and tamarind juice and let it cook till it becomes paste | 4
Take kadai put ghee and the tamarind powder and let it cook add rice and mix well | 5
Tamarind rice is ready to serve with curd | Thai Coconut Pancakes | Cherry bakewell baked oats (vegan) | Hara Bhara Kabab- A veg party starter | Hot-Dogity Sauce | Crockpot Cinnamon Bun Casserole | Cheesy, creamy tortellini | Slider smash chicken burgers | Vodka sauce chicken Sandwich | Smashed Meatball Sandwiches | Egg Mayo Sandwich Cake | Taco Bell Copycat Fiesta Potatoes | Lemon Butter Garlic Halibut | Egg Mayo Sandwich Cake | 4th of July Lunch",https://cookpad.com/eng/recipes/24825843,"2 cups cooked rice, 1/4 easpoon salt, 1/4 teaspoon turmeric powder, 1 tablespoon ghee, Spice powder for tamarind rice, 4 dry red chillies, 2 teaspoons coriander seeds, 1 teaspoon chana dal, 1 teaspoon urad dal, 1/4 teaspoon methi seeds, 1/2 teaspoon black pepper, 1/2 teaspoon sesame seeds, 1/2 teaspoon hing, Tamarind pulp, 50 grams tamarind, 2 cup hot water, Tempering and other ingredients for tamarind rice, 3 tablespoons oil, 1/4 cup peanuts, 1/4 teaspoon turmeric powder, 1/2 teaspoon hing, 1 sprig curry leaves, 2-3 dry red chillies, 1/2 teaspoon salt, 2 teaspoons jaggery powder, 😋
2, ❤️
8, 👏
4, Tamarind rice
One of the best, delicious South Indian rice preparations. It has tangy/sour, spicy taste.
Coco, Mango rice
#favcuisine
Sabina Tabassum, Lemon Rice with leftover rice
#goldenapron3 Clue used- rice, leftover #DC #postno7 Jhatpat recipe #icookathome #quarantinelife
RUCHIKA, Lemon rice with coconut chutney
#colouryellow Lemon rice with coconut chutney south is very famous
Karuna Naveen Chandwani, Mango Rice
Mango rice is a famous south indian food which is made by using raw mango, steamed rice and some simple ingredients. It is absolutely delicious. It is very easy to make yet very tasty. One can make this simple tangy flavoured rice preparation by following some simple steps. #riceisthebest
Joyeta Biswas, Mango rice
#favourite
Rohini Gupta, Coconut Rice
#mysterybox 3 #Cashews
Rakhee Rathi, Rice (அரிசி) upma
This is a very fragrant recipe complete with carbs, packed with protein and a splash of essential fat and digestive herbs to keep your tummy healthy! What's more? Completely vegan and very delicious too!😋😋
Lakshmi Balaji, Raw Mango Rice
Have you ever tried Mango rice?? If not, then give your boring rice a makeover with this lovely recipe. I was scrolling through YouTube and there I came across this lovely recipe which includes unripe mangoes (kacha aam) to give a healthy twist to our regular rice. We, here in the North, do not relish rice this way, so it was pretty new flavour for my family. The raw mango gives tangy taste to the rice whereas assorted dals and peanuts give it a crunch, a tantalizing aroma and interesting mouth feel. You can savour it with side dishes like ginger chutney or curd. But I devoured this as it is, enjoying every bite and feeling every single flavour. Yummmm! #khana
Vertika Tyagi"
