Title,Cook Time,Servings,Ingredients,Instructions,URL,ingredients_per_person
Ragi Mudde with brown rice and moolangi sambar,,,"1/4 cup brown rice (soaked for 3-4 hours), 1/4 cup ragi flour (finger Millet flour), 1/2 cup water, to taste Salt, 1/2 tbsp ghee, Rajma Curry (Kidney Beans) with Brown rice
116cal - Good in fiber, North indian Recipe. Preferred along rice. #healthy #week2of5
Asma Farheen, King tender coconut brown rice sweet pongal
#jaggery The red tender coconut is called by king of the coconut . so its called by king tender coconut. I used in this recipe king tender coconut drink and also i used brown rice its very healthy and very tasteful. Its fully boiled by king (red) coconut drink juice. Differnt sweet pongal.
Adaikkammai Annamalai, Chicken curry with brown rice
joannakiii, Curry brown rice with veggies
Youssef Hanna, Brown rice with mushrooms and mussels
Make it spicy by adding the sriracha sauce listed below
Lyudmil Stoev, Brown Rice with Hijiki Seaweed
Brown rice and hijiki seaweed are key ingredients in macrobiotics. I think (and it may be just my own perspective) brown rice tastes the best when it is cooked with just a few ingredients. (I prefer using white rice when I want to add a lot of ingredients. lol.) Please refer to how to cook delicious brown rice for detailed directions when you cook the brown rice. You do not need to rehydrate the hijiki seaweed. Just rinse it lightly with water. I recommend using soy sauce and salt with no preservatives (100% natural ingredients, prepared to suit a macrobiotic diet). Recipe by Yukiline
cookpad.japan, Aamras kheer (with cane sugar and brown rice)
A dessert by accident 😄😄 I kept the milk to boil when having breakfast and happily forgot about it. When I checked in the kitchen, it had boiled down to half it's quantity and thickened! So thought of making the most of the situation and made this yummy dessert. Am quite happy and proud of myself for this dish and the picture I clicked. 😄 Entering this for the food photography contest #CookClick
Soumya Pai, Beef and Vegetable Kebabs with Brown Rice
For the Performance Triad, please use the nutrient & serving size information provided below. Recipe Analysis: (1 serving = 1 kebab with 1/4 cup rice) Per Serving: 180 calories; 15 g protein; 4 g fat, 22 g carbs (1.5 carbs: 1 protein) Recipe = 2.5 servings of vegetables, 0 servings of fruit (1 vegetable per serving, 0 fruit per serving) *This recipe is from SGT Michael Fowler, Soldier Center Medical Home, Schofield Barracks, HI.
Performance Triad, Brown Rice with Vegetables
Trying to eat my veges
migo.cook","1/4 cup brown rice (soaked for 3-4 hours) | 1/4 cup ragi flour (finger Millet flour) | 1/2 cup water | to taste Salt | 1/2 tbsp ghee | 1
In a thick bottomed pan, add the soaked brown rice and water and bring it to a boil. | 2
Let it boil for 5-8 minutes untill the rice is soft. Add the salt and lower the flame | 3
Mix the ragi flour with a little water to make a smooth paste free from lumps. | 4
Add this to the boiling pan slowly and mix everything well. | 5
Let it come to a boil. Stir with a spoon vigorously till everything is combined and starts forming a lump | 6
Add the ghee and switch off the flame. Keep it covered. | 7
When it's easy to handle, but not fully cooked down, dip palm in cold water and form small balls/Mudde from the lump. | 8
Serve it with any spicy sambar and enjoy nutritious healthy food. | Thai Coconut Pancakes | Cherry bakewell baked oats (vegan) | Hara Bhara Kabab- A veg party starter | Hot-Dogity Sauce | Crockpot Cinnamon Bun Casserole | Chicken Spaghetti with Bacon, spinach, tomato, & mushrooms | Loaded Twice Baked Potatoes | Bacon Split Pea Soup (Instant Pot) | Rigatoni tuna salad | Sheik's ""Taste of Italy"": Melt in ur Mouth Meatballs | Watermelon rind halwa | Watermelon mousse | Happy happy biscute cake without oven | Turkey kebab with hummus roll",https://cookpad.com/eng/recipes/8236021,"1/4 cup brown rice (soaked for 3-4 hours), 1/4 cup ragi flour (finger Millet flour), 1/2 cup water, to taste Salt, 1/2 tbsp ghee, Rajma Curry (Kidney Beans) with Brown rice
116cal - Good in fiber, North indian Recipe. Preferred along rice. #healthy #week2of5
Asma Farheen, King tender coconut brown rice sweet pongal
#jaggery The red tender coconut is called by king of the coconut . so its called by king tender coconut. I used in this recipe king tender coconut drink and also i used brown rice its very healthy and very tasteful. Its fully boiled by king (red) coconut drink juice. Differnt sweet pongal.
Adaikkammai Annamalai, Chicken curry with brown rice
joannakiii, Curry brown rice with veggies
Youssef Hanna, Brown rice with mushrooms and mussels
Make it spicy by adding the sriracha sauce listed below
Lyudmil Stoev, Brown Rice with Hijiki Seaweed
Brown rice and hijiki seaweed are key ingredients in macrobiotics. I think (and it may be just my own perspective) brown rice tastes the best when it is cooked with just a few ingredients. (I prefer using white rice when I want to add a lot of ingredients. lol.) Please refer to how to cook delicious brown rice for detailed directions when you cook the brown rice. You do not need to rehydrate the hijiki seaweed. Just rinse it lightly with water. I recommend using soy sauce and salt with no preservatives (100% natural ingredients, prepared to suit a macrobiotic diet). Recipe by Yukiline
cookpad.japan, Aamras kheer (with cane sugar and brown rice)
A dessert by accident 😄😄 I kept the milk to boil when having breakfast and happily forgot about it. When I checked in the kitchen, it had boiled down to half it's quantity and thickened! So thought of making the most of the situation and made this yummy dessert. Am quite happy and proud of myself for this dish and the picture I clicked. 😄 Entering this for the food photography contest #CookClick
Soumya Pai, Beef and Vegetable Kebabs with Brown Rice
For the Performance Triad, please use the nutrient & serving size information provided below. Recipe Analysis: (1 serving = 1 kebab with 1/4 cup rice) Per Serving: 180 calories; 15 g protein; 4 g fat, 22 g carbs (1.5 carbs: 1 protein) Recipe = 2.5 servings of vegetables, 0 servings of fruit (1 vegetable per serving, 0 fruit per serving) *This recipe is from SGT Michael Fowler, Soldier Center Medical Home, Schofield Barracks, HI.
Performance Triad, Brown Rice with Vegetables
Trying to eat my veges
migo.cook"
Bread Upma,,,"4 bread slice, chopped, 1 onion, finely chopped (big), 2 tomato, finely chopped, 1/2 cup coloured bell pepper, finely chopped, 1 tsp mustard seeds, 5-6 curry leaves, 1 green chilli, finely chopped, 1 tsp ginger-garlic paste, 1/2 tsp red chilli powder, 1/2 tsp turmeric powder, 1/2 tsp cumin powder, to taste Salt, 1 tbsp tomato ketchup, as needed Drizzle of lemon juice, as needed Sev, to garnish, Bread Upma
#week_3_of_5 #no_junk_snacks #dish_name_bread_upma
Arpita Mukherjee, Bread upma
Easy to make bread upma. Filling breakfast to keep you going 😊
Samantha Noronha 1995, Bread tomato upma
#colourred #kidstiffin Healthy tomatoes and brown bread upma is best to give in kids tiffin box.Taste sweet,and tangy with the goodness of tomato and brown bread you can prepared with more bread stuff to serve in tiffin.
Neelu B., Bread Upma ~ Mumbai street style
Mumbai street style bread Upma. Spicy, Tangy with a zest of Lemon.
We Vegan, Vegetable Upma
#GA4#week 5#vegetable upma Very light and healthy breakfast dish. In my family from elders to kids like to eat upma. It is easy to make and easy to digest.
Chandni Khanna, Bread uttapam
Healthy breakfast
Nafeesa Mustafa, Broken Wheat Upma
#losingweight #ilovecooking
Reshma Praveen, Bread uttapam
#kidstiffin
Manisha Mav, Upma
#Tiffin
Kannu Arora","4 bread slice, chopped | 1 onion, finely chopped (big) | 2 tomato, finely chopped | 1/2 cup coloured bell pepper, finely chopped | 1 tsp mustard seeds | 5-6 curry leaves | 1 green chilli, finely chopped | 1 tsp ginger-garlic paste | 1/2 tsp red chilli powder | 1/2 tsp turmeric powder | 1/2 tsp cumin powder | to taste Salt | 1 tbsp tomato ketchup | as needed Drizzle of lemon juice | as needed Sev, to garnish | 1
1. Heat oil in pan, add mustard seeds and let it crackle. | 2
2. Now add curry leaves, followed by onion, ginger-garlic paste and green chillies. | 3
3. Saute this until onion turns light in colour. | 4
4. Now add tomatoes, salt, cumin powder, red chilli and turmeric powder. Let it cook until tomatoes are soft and mushy. | 5
5. Now add capsicum and saute for 1 min. | 6
6. Next add ketchup and lemon juice and mix well. | 7
7. Lastly add bread pieces and coat them well in masala. Saute until it coats evenly. | 8
8. Sprinkle sev and serve. | Thai Coconut Pancakes | Cherry bakewell baked oats (vegan) | Hara Bhara Kabab- A veg party starter | Hot-Dogity Sauce | Crockpot Cinnamon Bun Casserole | Sausage Calzones | Mini Wagon Wheel Pasta Salad | Bread pizza | Methu vada || ulundhu vada | Easy homeade pretzels | Chilli Chicken | Potato Paneer Pakora | Egg curry | Chana Dal Vada",https://cookpad.com/eng/recipes/9274090,"4 bread slice, chopped, 1 onion, finely chopped (big), 2 tomato, finely chopped, 1/2 cup coloured bell pepper, finely chopped, 1 tsp mustard seeds, 5-6 curry leaves, 1 green chilli, finely chopped, 1 tsp ginger-garlic paste, 1/2 tsp red chilli powder, 1/2 tsp turmeric powder, 1/2 tsp cumin powder, to taste Salt, 1 tbsp tomato ketchup, as needed Drizzle of lemon juice, as needed Sev, to garnish, Bread Upma
#week_3_of_5 #no_junk_snacks #dish_name_bread_upma
Arpita Mukherjee, Bread upma
Easy to make bread upma. Filling breakfast to keep you going 😊
Samantha Noronha 1995, Bread tomato upma
#colourred #kidstiffin Healthy tomatoes and brown bread upma is best to give in kids tiffin box.Taste sweet,and tangy with the goodness of tomato and brown bread you can prepared with more bread stuff to serve in tiffin.
Neelu B., Bread Upma ~ Mumbai street style
Mumbai street style bread Upma. Spicy, Tangy with a zest of Lemon.
We Vegan, Vegetable Upma
#GA4#week 5#vegetable upma Very light and healthy breakfast dish. In my family from elders to kids like to eat upma. It is easy to make and easy to digest.
Chandni Khanna, Bread uttapam
Healthy breakfast
Nafeesa Mustafa, Broken Wheat Upma
#losingweight #ilovecooking
Reshma Praveen, Bread uttapam
#kidstiffin
Manisha Mav, Upma
#Tiffin
Kannu Arora"
Cauliflower Upma,,,"1 cup rava, 1/2 cup cauliflower florets, 1 sprig curry leaves, 5 green chilli chopped, 1/2 cup peas, 1 red chilli, 1 tsp mustard seeds, 1 tsp urad dal, 1/2 tsp hing, 1 tsp lemon juice, Salt to taste, 2 tsp coriander leaves chopped, 2 tsp coconut grated, 😋
4, ❤️
10, 👏
6, Peas upma
Peas upma
shravani j, Upma (for tiffen box)
When I get up late and have less time to make breakfast best option is upma
Madhu Mj, Red rava upma (goduma rava upma)
Its a famous southindian upma made with wheat rava which is dark brown in color and texture is just like normal idly rava. Same as sooji upma only difference is we need to add more water here as red rava is hard so to make is soft & fully cooked we need to add water as per the requirements. Oil requirement is more then sooji upma. Can add rosted cashews.
Shrajiv Kosanam, Sevai / Vermicelli Upma
This is a perfectly healthy and light breakfast or an evening snack option. One can add vegetables like peas, carrots, beans, capsicum etc. to enhance the nutrient content and flavours of the dish.
Sonal Sardesai Gautam, Rava upma
One of the many things to do with sooji(rava) is upma which is a healthy breakfast meal.Topped with veggies and peanuts its wholesome and rich in taste. #breakfast
shreyaas_world, Semolina veg Upma
Semolina or rawa sooji is a healthy breakfast or evening tea time snack with enrichment of vitamins and minerals rich veggies and protein laden peanuts and omega 3 rich cashew nuts....
sangeeta Sethi, Soybeans Upma
#dals Protein packed soybeans upma Ideal for your breakfast or evening snacks
RUCHIKA, Broken Wheat upma | Dalia upma
A healthy and tasty recipe made from broken wheat . Nutritionally its an alternate for traditional sooji upma. We can have it anytime since its easy to digest.
JustFood, Railway train upma
It is memorable when we were travelling in train kerala express we always got this upma and relish the taste of it my husband likes this rather than south Indian upma with coconut and all
Rita Mehta ( Executive chef )","1 cup rava | 1/2 cup cauliflower florets | 1 sprig curry leaves | 5 green chilli chopped | 1/2 cup peas | 1 red chilli | 1 tsp mustard seeds | 1 tsp urad dal | 1/2 tsp hing | 1 tsp lemon juice | Salt to taste | 2 tsp coriander leaves chopped | 2 tsp coconut grated | 1
Fry sooji till nice aroma transfer to the plate | 2
Heat oil add mustard seeds,urad dal, curry leaves,red chilli, green chilli and cauliflower florets fry for a few minutes then add peas and cook for another minute then add 3 cups of water and let it boil. | 3
Add lemon juice,hing and roasted sooji mix it well and cook upma till done. Add chopped coriander leaves and coconut. | 4
Upma is ready to serve/enjoy. | Thai Coconut Pancakes | Cherry bakewell baked oats (vegan) | Hara Bhara Kabab- A veg party starter | Hot-Dogity Sauce | Crockpot Cinnamon Bun Casserole | Gluten free chewy chocolate cake with almond flour | California Farm Refried Turtle Beans | 5 Minute Peanut Butter | California Farm Refried Turtle Beans | Gluten free chewy chocolate cake with almond flour | Pumpkin Hummus",https://cookpad.com/eng/recipes/24219105,"1 cup rava, 1/2 cup cauliflower florets, 1 sprig curry leaves, 5 green chilli chopped, 1/2 cup peas, 1 red chilli, 1 tsp mustard seeds, 1 tsp urad dal, 1/2 tsp hing, 1 tsp lemon juice, Salt to taste, 2 tsp coriander leaves chopped, 2 tsp coconut grated, 😋
4, ❤️
10, 👏
6, Peas upma
Peas upma
shravani j, Upma (for tiffen box)
When I get up late and have less time to make breakfast best option is upma
Madhu Mj, Red rava upma (goduma rava upma)
Its a famous southindian upma made with wheat rava which is dark brown in color and texture is just like normal idly rava. Same as sooji upma only difference is we need to add more water here as red rava is hard so to make is soft & fully cooked we need to add water as per the requirements. Oil requirement is more then sooji upma. Can add rosted cashews.
Shrajiv Kosanam, Sevai / Vermicelli Upma
This is a perfectly healthy and light breakfast or an evening snack option. One can add vegetables like peas, carrots, beans, capsicum etc. to enhance the nutrient content and flavours of the dish.
Sonal Sardesai Gautam, Rava upma
One of the many things to do with sooji(rava) is upma which is a healthy breakfast meal.Topped with veggies and peanuts its wholesome and rich in taste. #breakfast
shreyaas_world, Semolina veg Upma
Semolina or rawa sooji is a healthy breakfast or evening tea time snack with enrichment of vitamins and minerals rich veggies and protein laden peanuts and omega 3 rich cashew nuts....
sangeeta Sethi, Soybeans Upma
#dals Protein packed soybeans upma Ideal for your breakfast or evening snacks
RUCHIKA, Broken Wheat upma | Dalia upma
A healthy and tasty recipe made from broken wheat . Nutritionally its an alternate for traditional sooji upma. We can have it anytime since its easy to digest.
JustFood, Railway train upma
It is memorable when we were travelling in train kerala express we always got this upma and relish the taste of it my husband likes this rather than south Indian upma with coconut and all
Rita Mehta ( Executive chef )"
Pesarattu upma (moong dal dosa with stuffed upma),,,"1 cup Moong daal, 10-12 Green Chillies, 2 inch ginger, 1 table spoon Cumin seeds, 1 table spoon salt, as required Oil or ghee to fry dosas, For stuffing, 1 Chopped onion,, 2 green chillies,, 1 inch ginger, 1 bunch coriander leaves chopped, 1 cup Semolina for making upma, 1 teaspoon mustard seeds, ❤️
4, Upma Pesarattu
Upma Pesarattu is a very famous breakfast dish of Andhra Pradesh. The combination of Upma with Pesarattu (Dosa made with green moong dal) goes perfectly together, and with a side of ginger / onion chutney, it is a heat, just like Poori-Halwa or Khara Baath-Kesari Bath. Upma Pesarattu is one such thing, which I really enjoy in my breakfast. This is full of  proteins  and nutrients and makes a good power packed breakfast. It is very filling so you wont really feel hungry soon. Although the process looks quite lengthy, believe me it doesn't take very long if you do all the preparations before hand (like :- soak the dals the previous night, making some chutney and keep it in the fridge). Also this is my entry for the contest conducted by #ReshKitchen
Pawani Mutturu, Pesarattu masala dosa
Try this healthy high protein low fat delicious dosa!
Spurthi Rao, Moong dal dosa
Protein rich healthy breakfast
Latha Thamil, Moong dal dosa
#goldenapron #post8
DrKhushboo Bansal, Pesarattu Dosa
Let go green today at breakfast. The uniqueness of this dosa is, it’s made with green moong dal, which is quick to make.Crispy Pesarattu Dosa filled with your choice of filling and served with allam chutney.perfect way to begin your day.
Sridivya Mukkamala, Moong dal and poha dosa
#GA4 #week3
Pradnya Khadpekar, Mini moong dal masala dosa
#GA4 #week3 #dosa
Pradnya Khadpekar, Green moong-dal dhirde |Green moong dal chila | Moong dal dosa
#losingweight Green Moong dal Dhirde or Green Moong dal Chila also known as green moong dal/green gram dosa or pancakes which are prepared similarly like our regular dosa. This recipe contains green moong dal/green gram as it's main ingredients.It is especially a snacks and breakfast dish widely popular in Andhra Pradesh as Pesarattu and in Maharashtra as Hirvya Moongache Dhirde.It's one of the healthy dish which is rich in proteins,high in fiber and has low calorie..It is a healthier,nutritious,lighter and wholesome option for breakfast.
Suchita Satpute, Kodo Millet (Kodri) Mogar Moog Dal Dosa
#losingweight #Post_4 #Date-30/5/2019 This dosa is very tasty, easy digestible, rich in vitamins,full of fiber helps in weight loss.
Ila Palan","1 cup Moong daal | 10-12 Green Chillies | 2 inch ginger | 1 table spoon Cumin seeds | 1 table spoon salt | as required Oil or ghee to fry dosas | For stuffing | 1 Chopped onion, | 2 green chillies, | 1 inch ginger | 1 bunch coriander leaves chopped | 1 cup Semolina for making upma | 1 teaspoon mustard seeds | 1
Soak Moong Dal over night and grind in to a thick batter adding chillies, cumin seeds and ginger. | 2
You may add water and make like dosa batter. Add salt. | 3
In a pan add one teaspoon of oil and add mustard and cumin seeds after spluttering add water and salt. When bubbling water add Semolina and cook. After two minutes of cooking switch off the flame. | 4
Place flat non- stick tawa on stove and take a ladle of batter and spread in circular form as thin as possible. | 5
Add stuffing inside with all above-mentioned ingredients and also upma | 6
Fry with ghee until golden in colour | 7
Serve hot with ginger chutney | Thai Coconut Pancakes | Cherry bakewell baked oats (vegan) | Hara Bhara Kabab- A veg party starter | Hot-Dogity Sauce | Crockpot Cinnamon Bun Casserole | Baked Spaghetti | Chilli chicken | Beef Bulgogi (불고기) | Chicken curry | 🧑🏽‍🍳🧑🏼‍🍳 Thai Holy Basil Stir-Fry Recipe (Pad Krapow) |ThaiChef food | Karela fry | Iceberg salad | Vegetarian Momos | Chilli chicken",https://cookpad.com/eng/recipes/13466759,"1 cup Moong daal, 10-12 Green Chillies, 2 inch ginger, 1 table spoon Cumin seeds, 1 table spoon salt, as required Oil or ghee to fry dosas, For stuffing, 1 Chopped onion,, 2 green chillies,, 1 inch ginger, 1 bunch coriander leaves chopped, 1 cup Semolina for making upma, 1 teaspoon mustard seeds, ❤️
4, Upma Pesarattu
Upma Pesarattu is a very famous breakfast dish of Andhra Pradesh. The combination of Upma with Pesarattu (Dosa made with green moong dal) goes perfectly together, and with a side of ginger / onion chutney, it is a heat, just like Poori-Halwa or Khara Baath-Kesari Bath. Upma Pesarattu is one such thing, which I really enjoy in my breakfast. This is full of  proteins  and nutrients and makes a good power packed breakfast. It is very filling so you wont really feel hungry soon. Although the process looks quite lengthy, believe me it doesn't take very long if you do all the preparations before hand (like :- soak the dals the previous night, making some chutney and keep it in the fridge). Also this is my entry for the contest conducted by #ReshKitchen
Pawani Mutturu, Pesarattu masala dosa
Try this healthy high protein low fat delicious dosa!
Spurthi Rao, Moong dal dosa
Protein rich healthy breakfast
Latha Thamil, Moong dal dosa
#goldenapron #post8
DrKhushboo Bansal, Pesarattu Dosa
Let go green today at breakfast. The uniqueness of this dosa is, it’s made with green moong dal, which is quick to make.Crispy Pesarattu Dosa filled with your choice of filling and served with allam chutney.perfect way to begin your day.
Sridivya Mukkamala, Moong dal and poha dosa
#GA4 #week3
Pradnya Khadpekar, Mini moong dal masala dosa
#GA4 #week3 #dosa
Pradnya Khadpekar, Green moong-dal dhirde |Green moong dal chila | Moong dal dosa
#losingweight Green Moong dal Dhirde or Green Moong dal Chila also known as green moong dal/green gram dosa or pancakes which are prepared similarly like our regular dosa. This recipe contains green moong dal/green gram as it's main ingredients.It is especially a snacks and breakfast dish widely popular in Andhra Pradesh as Pesarattu and in Maharashtra as Hirvya Moongache Dhirde.It's one of the healthy dish which is rich in proteins,high in fiber and has low calorie..It is a healthier,nutritious,lighter and wholesome option for breakfast.
Suchita Satpute, Kodo Millet (Kodri) Mogar Moog Dal Dosa
#losingweight #Post_4 #Date-30/5/2019 This dosa is very tasty, easy digestible, rich in vitamins,full of fiber helps in weight loss.
Ila Palan"
Vermicelli Upma,,,"1 cup vermicelli, 2 cups water, 1 onion, 1 tomato, 1/ 4 tsp salt, 1 tbsp oil, 1 tsp sugar, 4-5 curry leaves, 2 green chillies, 1/ 8 tsp hing, 1 tbsp grated coconut, 1 tbsp Coriander leaves, 😋
2, ❤️
6, 👏
2, Sevai / Vermicelli Upma
This is a perfectly healthy and light breakfast or an evening snack option. One can add vegetables like peas, carrots, beans, capsicum etc. to enhance the nutrient content and flavours of the dish.
Sonal Sardesai Gautam, Shavige upma (vermicelli upma)
Healthy and easy recipe . #savory
Spurthi Rao, Wheat vermicelli upma
#week3of5
Pradnya Khadpekar, Vermicelli upma
#GA4 #week5 #Upma
Pradnya Khadpekar, Vermicelli Upma
Durayya, Vermicelli upma
I use to make it for my family as snacks and they love it..
sakshipriya.sp, Tomato Vermicelli Upma
#rss #post_no13
RUCHIKA, Bread tomato upma
#colourred #kidstiffin Healthy tomatoes and brown bread upma is best to give in kids tiffin box.Taste sweet,and tangy with the goodness of tomato and brown bread you can prepared with more bread stuff to serve in tiffin.
Neelu B., Oats upma
Control adding water to oats otherwise it gets mushy #myfirstrecipe #weightlossrecipe
HEMA C","1 cup vermicelli | 2 cups water | 1 onion | 1 tomato | 1/ 4 tsp salt | 1 tbsp oil | 1 tsp sugar | 4-5 curry leaves | 2 green chillies | 1/ 8 tsp hing | 1 tbsp grated coconut | 1 tbsp Coriander leaves | 1
Gather ingredients. Boil water and add vermicily in it boil for another 1 min. Add 1 tsp oil while boiling. | 2
Heat a pan,add oil, curry leaves, hing onion,green chillies and saute. Then add tomato, salt, sugar, nicely stir. Then add cooked vermicilies and Coriander leaves,. Mix it well. | 3
Serve hot in a plate. Garnish with grated coconut. | Thai Coconut Pancakes | Cherry bakewell baked oats (vegan) | Hara Bhara Kabab- A veg party starter | Hot-Dogity Sauce | Crockpot Cinnamon Bun Casserole | Sweet & Sour Chicken Bola-Bola (Meatballs) | Instant pot southern chicken and rice | Freezing Stuffed Peppers for the future | California Farm Bondon Potato Fritters in Air Fryer | Chickpea Fritters | Freezing Stuffed Peppers for the future | California Farm Bondon Potato Fritters in Air Fryer | Sweet & Sour Chicken Bola-Bola (Meatballs)",https://cookpad.com/eng/recipes/22663382,"1 cup vermicelli, 2 cups water, 1 onion, 1 tomato, 1/ 4 tsp salt, 1 tbsp oil, 1 tsp sugar, 4-5 curry leaves, 2 green chillies, 1/ 8 tsp hing, 1 tbsp grated coconut, 1 tbsp Coriander leaves, 😋
2, ❤️
6, 👏
2, Sevai / Vermicelli Upma
This is a perfectly healthy and light breakfast or an evening snack option. One can add vegetables like peas, carrots, beans, capsicum etc. to enhance the nutrient content and flavours of the dish.
Sonal Sardesai Gautam, Shavige upma (vermicelli upma)
Healthy and easy recipe . #savory
Spurthi Rao, Wheat vermicelli upma
#week3of5
Pradnya Khadpekar, Vermicelli upma
#GA4 #week5 #Upma
Pradnya Khadpekar, Vermicelli Upma
Durayya, Vermicelli upma
I use to make it for my family as snacks and they love it..
sakshipriya.sp, Tomato Vermicelli Upma
#rss #post_no13
RUCHIKA, Bread tomato upma
#colourred #kidstiffin Healthy tomatoes and brown bread upma is best to give in kids tiffin box.Taste sweet,and tangy with the goodness of tomato and brown bread you can prepared with more bread stuff to serve in tiffin.
Neelu B., Oats upma
Control adding water to oats otherwise it gets mushy #myfirstrecipe #weightlossrecipe
HEMA C"
