Title,Cook Time,Servings,Ingredients,Instructions,URL,ingredients_per_person
Rava upma,,,"1 cup Rava, Salt as required, Half tsp mix Mustard seeds and cumin seeds, 3 Potato, 1 cup Peanuts, 2 tsp Oil, Half tsp Asafoetida powder, 1 piece Neem leaves, dry red chilli, 1 tsp Turmeric powder, 6 cup water, leaves Coriander, Half tsp Ginger and spicy green chilli paste, 😋
2, ❤️
9, 👏
2, Rava upma
One of the many things to do with sooji(rava) is upma which is a healthy breakfast meal.Topped with veggies and peanuts its wholesome and rich in taste. #breakfast
shreyaas_world, Red rava upma (goduma rava upma)
Its a famous southindian upma made with wheat rava which is dark brown in color and texture is just like normal idly rava. Same as sooji upma only difference is we need to add more water here as red rava is hard so to make is soft & fully cooked we need to add water as per the requirements. Oil requirement is more then sooji upma. Can add rosted cashews.
Shrajiv Kosanam, Upma
#mysterybox3
Kusum Agarwal, Heart shape spicy upma
# Heart # Cookpad India Happy Valentine’s Day
Nayna Shah, Railway train upma
It is memorable when we were travelling in train kerala express we always got this upma and relish the taste of it my husband likes this rather than south Indian upma with coconut and all
Rita Mehta ( Executive chef ), Rice Rava Upma
#myrecipe Here is a very traditional way of having breakfast. This recipe reminds me of my grandmother's way of cooking. Very healthy and solid start of the day.
Srilakshmi, Upma😋
Nafeesa Mustafa, Bread Upma
#week_3_of_5 #no_junk_snacks #dish_name_bread_upma
Arpita Mukherjee, Poha upma
#week1of5 Quick and healthy breakfast.poha contain iron..
jassi Aarif","1 cup Rava | Salt as required | Half tsp mix Mustard seeds and cumin seeds | 3 Potato | 1 cup Peanuts | 2 tsp Oil | Half tsp Asafoetida powder | 1 piece Neem leaves, dry red chilli | 1 tsp Turmeric powder | 6 cup water | leaves Coriander | Half tsp Ginger and spicy green chilli paste | 1
Take rava roast it till goldenish in colour | 2
Now take another vessel Put oil in it add cumin seeds and mustard seeds
Also add neem leaves and dry red chilli
Than put potato in it, turmeric powder, salt, peanuts, ginger and spicy Green chilli paste
Add 1 cup water in it
Put it till potato becomes soft | 3
Than add 5 cup of water in it After 10-12 minutes add rava in it
Rava upma is ready for breakfast | Thai Coconut Pancakes | Cherry bakewell baked oats (vegan) | Hara Bhara Kabab- A veg party starter | Hot-Dogity Sauce | Crockpot Cinnamon Bun Casserole | Homemade Enchilada Sauce 🌶️ | Lemony Shrimp and Bean Stew | Crispy Pan Potatoes🥔 | Green Beans ham and potatoes | Oreo Icebox Cake | Crispy Pan Potatoes🥔 | Lemony Shrimp and Bean Stew | California Farm New Harvest Puffed Potatoes | Green Beans ham and potatoes",https://cookpad.com/eng/recipes/22586420,"1 cup Rava, Salt as required, Half tsp mix Mustard seeds and cumin seeds, 3 Potato, 1 cup Peanuts, 2 tsp Oil, Half tsp Asafoetida powder, 1 piece Neem leaves, dry red chilli, 1 tsp Turmeric powder, 6 cup water, leaves Coriander, Half tsp Ginger and spicy green chilli paste, 😋
2, ❤️
9, 👏
2, Rava upma
One of the many things to do with sooji(rava) is upma which is a healthy breakfast meal.Topped with veggies and peanuts its wholesome and rich in taste. #breakfast
shreyaas_world, Red rava upma (goduma rava upma)
Its a famous southindian upma made with wheat rava which is dark brown in color and texture is just like normal idly rava. Same as sooji upma only difference is we need to add more water here as red rava is hard so to make is soft & fully cooked we need to add water as per the requirements. Oil requirement is more then sooji upma. Can add rosted cashews.
Shrajiv Kosanam, Upma
#mysterybox3
Kusum Agarwal, Heart shape spicy upma
# Heart # Cookpad India Happy Valentine’s Day
Nayna Shah, Railway train upma
It is memorable when we were travelling in train kerala express we always got this upma and relish the taste of it my husband likes this rather than south Indian upma with coconut and all
Rita Mehta ( Executive chef ), Rice Rava Upma
#myrecipe Here is a very traditional way of having breakfast. This recipe reminds me of my grandmother's way of cooking. Very healthy and solid start of the day.
Srilakshmi, Upma😋
Nafeesa Mustafa, Bread Upma
#week_3_of_5 #no_junk_snacks #dish_name_bread_upma
Arpita Mukherjee, Poha upma
#week1of5 Quick and healthy breakfast.poha contain iron..
jassi Aarif"
Rice (அரிசி) upma,,,"1 cup is 250gms, 1 cup white rice, 1 cup toor dal (yellow), 2 tablespoons cumin seeds, 2 tablespoons black peppercorns, as needed Salt, 5 Dry red chillies, 2 teaspoons black mustard, 1 sprig curry leaves, 1/4 teaspoon hing/asafoetida, 1 tablespoon chana dal, 1 tablespoon white urad dal, Oil, 2 tablespoons coconut oil, 2 tablespoons sesame oil, 2 tablespoons sunflower oil, 😋
1, ❤️
2, Rice Rava Upma
#myrecipe Here is a very traditional way of having breakfast. This recipe reminds me of my grandmother's way of cooking. Very healthy and solid start of the day.
Srilakshmi, Sama rice upma
#toc3 #breakfast Usually sama rice is used for fasting but my family enjoys it always.it is fulfilling, healthy and can make with minimum ingredients.
Pradnya Khadpekar, Brown rice flake upma
sumathibalajji, Tandlachi Ukhad(rice flour upma)
#colouryellow #9thjuly Tandlachi Ukhad is Maharastrian breakfast recipe, it is very quick and healthy recipe.
Shilpa Wani, Puff rice upma in tart with phudina pani
#5pm
Pia Dharmin Thacker, Idli upma!!
To crumble idlis,smear your hand with oil is what I discovered.
Sharadha Sanjeev, Rice idli
#5pm
reemamakhija, Vermicelli upma
I use to make it for my family as snacks and they love it..
sakshipriya.sp, Peas upma
Peas upma
shravani j","1 cup is 250gms | 1 cup white rice | 1 cup toor dal (yellow) | 2 tablespoons cumin seeds | 2 tablespoons black peppercorns | as needed Salt | 5 Dry red chillies | 2 teaspoons black mustard | 1 sprig curry leaves | 1/4 teaspoon hing/asafoetida | 1 tablespoon chana dal | 1 tablespoon white urad dal | Oil | 2 tablespoons coconut oil | 2 tablespoons sesame oil | 2 tablespoons sunflower oil | 1
Measure 1 cup rice and 1 cup toor dal. Grind it coarsely. To ensure additional fragrance in the recipe, you can also dry roast the rice and dal in low flame and grind it. | 2
In the mix, throw in 3 red chillies, 1/2 sprig curry leaves, cumin seeds, black peppercorns and grind them all just for 10 seconds. | 3
Now in a heavy bottom pan; preferably steel, add in all the oils in the said quantity. Throw in mustard seeds, chana dal, urad dal, 1/2 sprig curry leaves, asafoetida, 2 red chillies. Sauté them in low flame till they turn fragrant. | 4
Then, add in 4 cups of water - preferably hot to speed up the cooking. Cover it and let the water reach a roller boil. Once it does, lower your flame to minimum; add in the salt as preferred and gently mix in the powder to the water. Make sure to stay careful as a few drops of water may splash around. | 5
Once the powder is mixed in keep stirring for a minute. Then cover and let it cook for 7 minutes in the lowest mark. Open and add water if needed. Else, give it a couple of stirs and take it off stove. It is now ready to serve. | 6
Notes: Rice brings carbs. Dals provide body building protein. Oils bring in fat. Cumin seeds help maintain body temperature while pepper, curry leaves, asafoetida and mustard help digestion. This is a wholesome meal. It can be consumed as such or with a side of chuney and sambar or; with plain whole yoghurt. | Thai Coconut Pancakes | Cherry bakewell baked oats (vegan) | Hara Bhara Kabab- A veg party starter | Hot-Dogity Sauce | Crockpot Cinnamon Bun Casserole | Thai Basil Beef | Instant Pot BBQ Pulled Chicken | Cookie's Cheeseburger Rolls | Keto Lasagna | Cinnamon Strawberry Cheesecake Dessert Tacos | Mom's Chili | Zucchini pancakes with cheese | Chicken bacon Butter garlic shrimp Asian style nachos | The Ultimate Creme Brulee",https://cookpad.com/eng/recipes/13109694,"1 cup is 250gms, 1 cup white rice, 1 cup toor dal (yellow), 2 tablespoons cumin seeds, 2 tablespoons black peppercorns, as needed Salt, 5 Dry red chillies, 2 teaspoons black mustard, 1 sprig curry leaves, 1/4 teaspoon hing/asafoetida, 1 tablespoon chana dal, 1 tablespoon white urad dal, Oil, 2 tablespoons coconut oil, 2 tablespoons sesame oil, 2 tablespoons sunflower oil, 😋
1, ❤️
2, Rice Rava Upma
#myrecipe Here is a very traditional way of having breakfast. This recipe reminds me of my grandmother's way of cooking. Very healthy and solid start of the day.
Srilakshmi, Sama rice upma
#toc3 #breakfast Usually sama rice is used for fasting but my family enjoys it always.it is fulfilling, healthy and can make with minimum ingredients.
Pradnya Khadpekar, Brown rice flake upma
sumathibalajji, Tandlachi Ukhad(rice flour upma)
#colouryellow #9thjuly Tandlachi Ukhad is Maharastrian breakfast recipe, it is very quick and healthy recipe.
Shilpa Wani, Puff rice upma in tart with phudina pani
#5pm
Pia Dharmin Thacker, Idli upma!!
To crumble idlis,smear your hand with oil is what I discovered.
Sharadha Sanjeev, Rice idli
#5pm
reemamakhija, Vermicelli upma
I use to make it for my family as snacks and they love it..
sakshipriya.sp, Peas upma
Peas upma
shravani j"
Wheat vermicelli upma,,,"2 bowls wheat vermicelli, 2 medium onions, 1 small tomato, 1 medium carrot, leaves Curry, Oil, asefoetida, salt, sugar, Water, 3-4 Green chillies, ❤️
3, Vermicelli upma
#GA4 #week5 #Upma
Pradnya Khadpekar, Vermicelli upma
I use to make it for my family as snacks and they love it..
sakshipriya.sp, Vermicelli Upma
Durayya, Broken wheat upma
A complete meal in itself which can be relished with pickle or any chutney
RUCHIKA, Tomato Vermicelli Upma
#rss #post_no13
RUCHIKA, Broken Wheat Upma
#losingweight #ilovecooking
Reshma Praveen, Broken Wheat upma | Dalia upma
A healthy and tasty recipe made from broken wheat . Nutritionally its an alternate for traditional sooji upma. We can have it anytime since its easy to digest.
JustFood, Sevai / Vermicelli Upma
This is a perfectly healthy and light breakfast or an evening snack option. One can add vegetables like peas, carrots, beans, capsicum etc. to enhance the nutrient content and flavours of the dish.
Sonal Sardesai Gautam, Semolina Upma
I experimented with the plating this time!! Cooking procedure was the same as usual as I do. But I love plating it differently everytime!
Manisha Madan (Thedelhifoodiecouple)","2 bowls wheat vermicelli | 2 medium onions | 1 small tomato | 1 medium carrot | leaves Curry | Oil, asefoetida, salt, sugar | Water | 3-4 Green chillies | 1
First dry roast vermicelli in a pan | 2
Take out in a plate | 3
Heat pan add oil | 4
Add mustard seeds, curry leaves, asefoetida | 5
Add chopped onion, carrot, tomato, green chillies saute till light brown | 6
Now add two big glass water, add sugar and salt as per taste | 7
When it boils add vermicellie, cook for five to seven minutes, serve hot with lemon and poody chutney। here you can serve with coconut chutney also | Thai Coconut Pancakes | Cherry bakewell baked oats (vegan) | Hara Bhara Kabab- A veg party starter | Hot-Dogity Sauce | Crockpot Cinnamon Bun Casserole | Sharon's Potato Salad | Basbusa | 1 Ingredient Banana Ice Cream (Vegan)🍌🍒🍌🍒🍌🍒🍌🍒🍌🍒🍌🍒🍌 | Cinnamon Rolls | Sushi Rice (Shari, Sumeshi, Sushimeshi) | Spinach Pulao | Balsamic, Brown Sugar Strawberries | Russian slaad | BLM Lumpia",https://cookpad.com/eng/recipes/12785342,"2 bowls wheat vermicelli, 2 medium onions, 1 small tomato, 1 medium carrot, leaves Curry, Oil, asefoetida, salt, sugar, Water, 3-4 Green chillies, ❤️
3, Vermicelli upma
#GA4 #week5 #Upma
Pradnya Khadpekar, Vermicelli upma
I use to make it for my family as snacks and they love it..
sakshipriya.sp, Vermicelli Upma
Durayya, Broken wheat upma
A complete meal in itself which can be relished with pickle or any chutney
RUCHIKA, Tomato Vermicelli Upma
#rss #post_no13
RUCHIKA, Broken Wheat Upma
#losingweight #ilovecooking
Reshma Praveen, Broken Wheat upma | Dalia upma
A healthy and tasty recipe made from broken wheat . Nutritionally its an alternate for traditional sooji upma. We can have it anytime since its easy to digest.
JustFood, Sevai / Vermicelli Upma
This is a perfectly healthy and light breakfast or an evening snack option. One can add vegetables like peas, carrots, beans, capsicum etc. to enhance the nutrient content and flavours of the dish.
Sonal Sardesai Gautam, Semolina Upma
I experimented with the plating this time!! Cooking procedure was the same as usual as I do. But I love plating it differently everytime!
Manisha Madan (Thedelhifoodiecouple)"
Crispy Kerala Style Banana Fritters | Pazham Pori | Ethakka Appam,,,"5 Kerala Nendran Bananas (ripe and firm), 1 cup Self-Raising Flour, 1 tbsp Rice Flour, 1 tbsp Powdered Sugar, 1/8 tsp Turmeric Powder, 1 tbsp Black Sesame Seeds, 1/8 tsp Baking Powder, 1 cup Water (adjust as needed), Salt, to taste, Coconut Oil, for deep frying, 😋
4, ❤️
11, 👏
5, Ghee Appam
One of my favorite dish.Ghee Appam is a Tea snack made from rice, jaggery, ripe banana, pinch of salt, fresh grated coconut, roasted sesame seeds and cardamom powder fried in ghee.It as a prasad from Lord Ayyappa.Crispy on the outside and a soft inside with a yummy😋 banana flavor.
Hari Mamata Sahu, Sweet Banana Appam
#deepfried
Reshma Praveen, Chakka appam/ steamed jackfruit rice cake
#goldenapron #nonindian Steamed jackfruit rice cake is prepared with ripe jackfruit and trust me it is so yummy any soft to eat. The major ingredient used over is from my parents garden, the jackfruit, coconut and banana leaves. This is one of traditional recipes from Kerala that is not commonly made nowadays due to fast life and no time. I love to keep up my tradition so whenever I am in my parents house I do make it a point to maximum use all vegetables and fruits from our garden.
Inish Issac, Banana appam with white sauce
#week5of5 #desserts
Pradnya Khadpekar, Soji appam
#FM #W4 In Karnataka they do it on festival days like Navratri and Diwali. Grandma was from Karnataka. It is popular in Tamilnadu also.
Lakshmi Sridharan Ph D, Palappam recipe | Appam recipe without yeast | Kerala Appam recipe
Palappam is an extended version of plain appam or vella appam recipe to which grated coconut is added while grounding. later the fermented batter is poured to bowl shaped pan to yield a bowl shaped pancake’s. i would like to share few tips and recommendations to be considered while preparing kerala palappam recipe. firstly, i have used idli rice in this recipe for better fermentation and result. you can use normal day to day rice like sona masuri but i heavily recommend to use idli rice for better result. secondly, as mentioned previously fermentation is key process. but if you are living in a cold region, you can place the batter in preheated oven to hasten the fermentation process. lastly, you can store the fermented batter in refrigerator for about 2-3 days and scoop out only required amount of batter to prepare spongy appam recipe.
SaranyaSenthil, Jaalar Appam || Net pancakes || Malaysian net crepes || Roti Jaala
This is a must try recipe and can be served as it is,rolled or folded.It is a Malaysian famous food they served this with malaysian style chicken curry where as in india they serve this with vattalappam.#cookmybook
JustFood, Banana Fritters (Ethakka Appam Or Pazham Pori)
#rainbowweek1 #orange_recipes #rosalyn_kitchen Crispy and sweet Kerala Style Pazham Pori is a very popular, common and all time favorite snack of Malayalees. It's a very simple snack made with ripe plantain. Sliced plaintain dipped into batter and deep fried in coconut oil. This makes the snack unique.
Rosalyn John, Ethakka Appam / Banana Fritters
Ethakka Appam is a very popular dish from Kerala which is made out of plantains. The way pakoda or bhajji are eaten in northern states in monsoon season, ethakka appam is eaten in Kerala. Special bananas are used for this dish which are available in South Indian grocery chops. We can even make it from normal ripe bananas but it should hard. This dish is served with coffee or tea. #tech2 #post8
spicequeen","5 Kerala Nendran Bananas (ripe and firm) | 1 cup Self-Raising Flour | 1 tbsp Rice Flour | 1 tbsp Powdered Sugar | 1/8 tsp Turmeric Powder | 1 tbsp Black Sesame Seeds | 1/8 tsp Baking Powder | 1 cup Water (adjust as needed) | Salt, to taste | Coconut Oil, for deep frying | 1
In a large mixing bowl, combine self-raising flour, rice flour, powdered sugar, turmeric powder, black sesame seeds, baking powder, and salt. Mix well. | 2
Gradually add water, whisking continuously to form a smooth, lump-free batter. The consistency should be slightly thick but not too runny. | 3
Peel and slice the Nendran bananas lengthwise or into desired shapes. | 4
Dip each banana slice into the batter, ensuring an even coating. If the batter is too thick, add a little more water. | 5
Heat coconut oil in a heavy-bottomed kadai over medium heat. | 6
Carefully drop the batter-coated banana slices into the hot oil. Fry until golden brown and crisp. | 7
Remove and place them on a strainer or paper towel to drain excess oil. | 8
Serve hot with a cup of chai or coffee. Enjoy the crispy goodness! ☕🍌 | Thai Coconut Pancakes | Cherry bakewell baked oats (vegan) | Hara Bhara Kabab- A veg party starter | Hot-Dogity Sauce | Crockpot Cinnamon Bun Casserole | Gochujang shrimp 🦐✨ | Asian Inspired Scallop Crudo | Homemade Beer 🍺 Bread!! | 5 Ingredient Chinese Steamed Cake (rice cooker edition!) | Beef Kare-Kare | Beef Kare-Kare | CRISPY LIEMPO KARE-KARE | Gochujang shrimp 🦐✨ | 5 Ingredient Chinese Steamed Cake (rice cooker edition!)",https://cookpad.com/eng/recipes/24698762,"5 Kerala Nendran Bananas (ripe and firm), 1 cup Self-Raising Flour, 1 tbsp Rice Flour, 1 tbsp Powdered Sugar, 1/8 tsp Turmeric Powder, 1 tbsp Black Sesame Seeds, 1/8 tsp Baking Powder, 1 cup Water (adjust as needed), Salt, to taste, Coconut Oil, for deep frying, 😋
4, ❤️
11, 👏
5, Ghee Appam
One of my favorite dish.Ghee Appam is a Tea snack made from rice, jaggery, ripe banana, pinch of salt, fresh grated coconut, roasted sesame seeds and cardamom powder fried in ghee.It as a prasad from Lord Ayyappa.Crispy on the outside and a soft inside with a yummy😋 banana flavor.
Hari Mamata Sahu, Sweet Banana Appam
#deepfried
Reshma Praveen, Chakka appam/ steamed jackfruit rice cake
#goldenapron #nonindian Steamed jackfruit rice cake is prepared with ripe jackfruit and trust me it is so yummy any soft to eat. The major ingredient used over is from my parents garden, the jackfruit, coconut and banana leaves. This is one of traditional recipes from Kerala that is not commonly made nowadays due to fast life and no time. I love to keep up my tradition so whenever I am in my parents house I do make it a point to maximum use all vegetables and fruits from our garden.
Inish Issac, Banana appam with white sauce
#week5of5 #desserts
Pradnya Khadpekar, Soji appam
#FM #W4 In Karnataka they do it on festival days like Navratri and Diwali. Grandma was from Karnataka. It is popular in Tamilnadu also.
Lakshmi Sridharan Ph D, Palappam recipe | Appam recipe without yeast | Kerala Appam recipe
Palappam is an extended version of plain appam or vella appam recipe to which grated coconut is added while grounding. later the fermented batter is poured to bowl shaped pan to yield a bowl shaped pancake’s. i would like to share few tips and recommendations to be considered while preparing kerala palappam recipe. firstly, i have used idli rice in this recipe for better fermentation and result. you can use normal day to day rice like sona masuri but i heavily recommend to use idli rice for better result. secondly, as mentioned previously fermentation is key process. but if you are living in a cold region, you can place the batter in preheated oven to hasten the fermentation process. lastly, you can store the fermented batter in refrigerator for about 2-3 days and scoop out only required amount of batter to prepare spongy appam recipe.
SaranyaSenthil, Jaalar Appam || Net pancakes || Malaysian net crepes || Roti Jaala
This is a must try recipe and can be served as it is,rolled or folded.It is a Malaysian famous food they served this with malaysian style chicken curry where as in india they serve this with vattalappam.#cookmybook
JustFood, Banana Fritters (Ethakka Appam Or Pazham Pori)
#rainbowweek1 #orange_recipes #rosalyn_kitchen Crispy and sweet Kerala Style Pazham Pori is a very popular, common and all time favorite snack of Malayalees. It's a very simple snack made with ripe plantain. Sliced plaintain dipped into batter and deep fried in coconut oil. This makes the snack unique.
Rosalyn John, Ethakka Appam / Banana Fritters
Ethakka Appam is a very popular dish from Kerala which is made out of plantains. The way pakoda or bhajji are eaten in northern states in monsoon season, ethakka appam is eaten in Kerala. Special bananas are used for this dish which are available in South Indian grocery chops. We can even make it from normal ripe bananas but it should hard. This dish is served with coffee or tea. #tech2 #post8
spicequeen"
Upma,,,"1 onion, 1 inch ginger, 4-5 curry leaves, 1 cup soji, 1 teaspoon mustard, 1 teaspoon urad dal, 1 tablespoon Chana dal, 1 teaspoon salt, 1 tablespoon oil, 2 green chilis, 1 cup water, Upma
#Tiffin
Kannu Arora, Upma
#mysterybox3
Kusum Agarwal, Upma
Spurthi Rao, Upma😋
Nafeesa Mustafa, Simple upma
Easy and quick recipe
shravani j, Upma Pesarattu
Upma Pesarattu is a very famous breakfast dish of Andhra Pradesh. The combination of Upma with Pesarattu (Dosa made with green moong dal) goes perfectly together, and with a side of ginger / onion chutney, it is a heat, just like Poori-Halwa or Khara Baath-Kesari Bath. Upma Pesarattu is one such thing, which I really enjoy in my breakfast. This is full of  proteins  and nutrients and makes a good power packed breakfast. It is very filling so you wont really feel hungry soon. Although the process looks quite lengthy, believe me it doesn't take very long if you do all the preparations before hand (like :- soak the dals the previous night, making some chutney and keep it in the fridge). Also this is my entry for the contest conducted by #ReshKitchen
Pawani Mutturu, Bread upma
Easy to make bread upma. Filling breakfast to keep you going 😊
Samantha Noronha 1995, Upma sandwich
#jhatpat
Gupta Mithlesh, Peas upma
Peas upma
shravani j","1 onion | 1 inch ginger | 4-5 curry leaves | 1 cup soji | 1 teaspoon mustard | 1 teaspoon urad dal | 1 tablespoon Chana dal | 1 teaspoon salt | 1 tablespoon oil | 2 green chilis | 1 cup water | 1
In hot kadai, add oil and put mustard seeds and once mustard seeds are spatter, add urad dal curry Leafs, Chana dal | 2
Now add chopped onion and spilled green chili’s and cook till onion become clear | 3
Add I cup water and let it boil | 4
Once water boiled add soji and cook till it comes out cleanly | Thai Coconut Pancakes | Cherry bakewell baked oats (vegan) | Hara Bhara Kabab- A veg party starter | Hot-Dogity Sauce | Crockpot Cinnamon Bun Casserole | Pork Humba | Cherry Dr. Pepper Glazed City Ham | Dessert pizza | Alkaline - Portabella (steak)Mushrooms and Gravy | BLT Pasta Salad | Slow Cooker Shredded Beef BBQ | Banana pancake | Vegetarian chili | Rice and eggs",https://cookpad.com/eng/recipes/8117909,"1 onion, 1 inch ginger, 4-5 curry leaves, 1 cup soji, 1 teaspoon mustard, 1 teaspoon urad dal, 1 tablespoon Chana dal, 1 teaspoon salt, 1 tablespoon oil, 2 green chilis, 1 cup water, Upma
#Tiffin
Kannu Arora, Upma
#mysterybox3
Kusum Agarwal, Upma
Spurthi Rao, Upma😋
Nafeesa Mustafa, Simple upma
Easy and quick recipe
shravani j, Upma Pesarattu
Upma Pesarattu is a very famous breakfast dish of Andhra Pradesh. The combination of Upma with Pesarattu (Dosa made with green moong dal) goes perfectly together, and with a side of ginger / onion chutney, it is a heat, just like Poori-Halwa or Khara Baath-Kesari Bath. Upma Pesarattu is one such thing, which I really enjoy in my breakfast. This is full of  proteins  and nutrients and makes a good power packed breakfast. It is very filling so you wont really feel hungry soon. Although the process looks quite lengthy, believe me it doesn't take very long if you do all the preparations before hand (like :- soak the dals the previous night, making some chutney and keep it in the fridge). Also this is my entry for the contest conducted by #ReshKitchen
Pawani Mutturu, Bread upma
Easy to make bread upma. Filling breakfast to keep you going 😊
Samantha Noronha 1995, Upma sandwich
#jhatpat
Gupta Mithlesh, Peas upma
Peas upma
shravani j"
