recipe_id,title,instructions,calories,protein_g,carbs_g,fat_g,estimated_cost_lkr
199,Sri Lankan Thati Paan (flat-bread),"Mix water and milk together. Make sure they both are in lukewarm temp. Dump the sugar. Do not mix. Sprinkle the yeast over the surface. It should start to foam up immediately on the edges.(If not your yeast is not good and might have expired. Throw away and start fresh with new yeast.); Mix water and milk together. Make sure they both are in lukewarm temp. Dump the sugar. Do not mix. Sprinkle the yeast over the surface. It should start to foam up immediately on the edges.; (If not your yeast is not good and might have expired. Throw away and start fresh with new yeast.); Add softened butter and salt. give a quick mix. And then add flour.; Add softened butter and salt. give a quick mix. And then add flour.; Knead the dough (about 8 - 10mins in the machine or 15-20 mins with hands) until it becomes soft, pliable, and lump-free. Read the recipe description for hand kneading instructions.; Knead the dough (about 8 - 10mins in the machine or 15-20 mins with hands) until it becomes soft, pliable, and lump-free. Read the recipe description for hand kneading instructions.; Make the dough into a rough ball with your hands. Apply some oil to the bowl. Put the dough in, seam side down. And apply a few drops of oil on top of the dough as well. Cover with plastic wrap.; Make the dough into a rough ball with your hands. Apply some oil to the bowl. Put the dough in, seam side down. And apply a few drops of oil on top of the dough as well. Cover with plastic wrap.; Let the dough rise until it's doubled in size. This would take roughly about 1 hr depending on the room temperature. Focus on the volume rather than time.; Let the dough rise until it's doubled in size. This would take roughly about 1 hr depending on the room temperature. Focus on the volume rather than time.; Transfer the dough to your worktop and remove gas by pressing the dough down.; Transfer the dough to your worktop and remove gas by pressing the dough down.; Divide the dough into 6 equal pieces. Roughly about 265g each.; Divide the dough into 6 equal pieces. Roughly about 265g each.; Make each dough piece into rough balls with your hands. Arrange them on aside of your worktop. Cover with a piece of plastic wrap again and let them rest for about 15 mins. So the gluten would have some time to relax and it would be easier to flatten them out in the next step; Make each dough piece into rough balls with your hands. Arrange them on aside of your worktop. Cover with a piece of plastic wrap again and let them rest for about 15 mins. So the gluten would have some time to relax and it would be easier to flatten them out in the next step; Meanwhile, make the oil-flour mixture in a small bowl.; Meanwhile, make the oil-flour mixture in a small bowl.; Take one ball out and flatten it out to a rectangular shape. The width should be similar to the width of the bread pan you’re using. Use your bread pan as a guideline.; Take one ball out and flatten it out to a rectangular shape. The width should be similar to the width of the bread pan you’re using. Use your bread pan as a guideline.; Turn it upside down.So when you roll the dough the smoother surface goes to the outer visible side.; Turn it upside down.So when you roll the dough the smoother surface goes to the outer visible side.; Roll the dough from top to bottom.Seal the edges with your fingers by pressing the edge with the dough or turn the seam side down to face the worktop and press the dough gently with your hands so the edges stick to the dough. Seal left and right sides too.It should look like a cylinder now. (Three of these cylindrical-shaped doughs go into one loaf pan). Also, cover the inside of the loaf pans with butter or oil.; Roll the dough from top to bottom.Seal the edges with your fingers by pressing the edge with the dough or turn the seam side down to face the worktop and press the dough gently with your hands so the edges stick to the dough. Seal left and right sides too.It should look like a cylinder now. (Three of these cylindrical-shaped doughs go into one loaf pan). Also, cover the inside of the loaf pans with butter or oil.; Transfer the dough into the loaf pan, seam side down, and push it to one side. Apply the oil-flour mixture on the visible side so it's easier to separate bread.; Transfer the dough into the loaf pan, seam side down, and push it to one side. Apply the oil-flour mixture on the visible side so it's easier to separate bread.; Make two more cylindrical-shaped doughs for one loaf pan. Put the second dough in. You may see that there isn’t enough space for the third one. Now press the two doughs together to get enough space for the third one as shown in the photo. So they become slightly flat. Apply the flour-oil mixture on the side.; Make two more cylindrical-shaped doughs for one loaf pan. Put the second dough in. You may see that there isn’t enough space for the third one. Now press the two doughs together to get enough space for the third one as shown in the photo. So they become slightly flat. Apply the flour-oil mixture on the side.; Press the third one on the worktop to flatten it out a little bit so it's easier to fit in the loaf pan. Put the dough in. Only three doughs go into one pan. Fill another loaf pan with the other three dough balls the same way we did earlier.Cover them with plastic wrap.; Press the third one on the worktop to flatten it out a little bit so it's easier to fit in the loaf pan. Put the dough in. Only three doughs go into one pan. Fill another loaf pan with the other three dough balls the same way we did earlier.Cover them with plastic wrap.; Let them rise until the middle of the dough reaches about an inch above the rim of the pan. Or they’ve doubled in size again. This would take roughly about 45 mins. Also, don't forget to preheat your oven to 400F/ 200C for about 20 mins.; Let them rise until the middle of the dough reaches about an inch above the rim of the pan. Or they’ve doubled in size again. This would take roughly about 45 mins. Also, don't forget to preheat your oven to 400F/ 200C for about 20 mins.; When they’re are properly risen, spray (or brush if you don’t have a spray) some water on the top of the bread. This will help the bread to rise better in the oven and make the top crusty.; When they’re are properly risen, spray (or brush if you don’t have a spray) some water on the top of the bread. This will help the bread to rise better in the oven and make the top crusty.; Bake them in the oven for about 30 - 40 mins. This time varies from oven to oven.If you’re using a smaller convectional oven there is a chance that your bread browns quicker. Check on your bread after about 20 mins. If they seem to brown too quickly, transfer them to a lower rack and reduce the temperature a little bit. (Read important info on recipe description); Bake them in the oven for about 30 - 40 mins. This time varies from oven to oven.If you’re using a smaller convectional oven there is a chance that your bread browns quicker. Check on your bread after about 20 mins. If they seem to brown too quickly, transfer them to a lower rack and reduce the temperature a little bit. (Read important info on recipe description); Separate each Thati paan carefully and lay them on a baking sheet.; Separate each Thati paan carefully and lay them on a baking sheet.; Turn on the broiler setting in the oven. Apply melted/softened butter or coconut oil on one side first. Then broil for about a minute or two until they get nice and brown. (for more info read the “important info” part in the recipe description.); Turn on the broiler setting in the oven. Apply melted/softened butter or coconut oil on one side first. Then broil for about a minute or two until they get nice and brown. (for more info read the “important info” part in the recipe description.); Then turn the other side. Apply butter or coconut oil and broil again until nice and brown. Let the bread cool down on a cooling rack for a while before you cut them. So the crumbs can settle in.; Then turn the other side. Apply butter or coconut oil and broil again until nice and brown. Let the bread cool down on a cooling rack for a while before you cut them. So the crumbs can settle in.",0.0,0.0,0.0,0.0,4.7
200,Sri Lankan Fish Cutlets,"Boil potatoes with ¼ tsp turmeric and ½ tsp salt. Drain when the potatoes are fork-tender and then leave them to cool down and dry out. Do not boil potatoes until they become mushy.; Boil potatoes with ¼ tsp turmeric and ½ tsp salt. Drain when the potatoes are fork-tender and then leave them to cool down and dry out. Do not boil potatoes until they become mushy.; And then mash them with a fork or a spoon.; And then mash them with a fork or a spoon.; Heat 2 tsp oil. Add garlic, curry leaves, onion, and green chili. Make sure everything is finely chopped. Fry everything on medium heat until the onions become soft and dry.; Heat 2 tsp oil. Add garlic, curry leaves, onion, and green chili. Make sure everything is finely chopped. Fry everything on medium heat until the onions become soft and dry.; Then add 2 tsp of chili flakes. Mix well with the mixture.; Then add 2 tsp of chili flakes. Mix well with the mixture.; Move everything aside and add the mackerel can (completely drained) Mash them with your spoon until there are no chunks left. Alternatively, you can mash them before you add them to the pan too.; Move everything aside and add the mackerel can (completely drained) Mash them with your spoon until there are no chunks left. Alternatively, you can mash them before you add them to the pan too.; Add 1/4tsp turmeric and salt to your taste. Mix well.; Add 1/4tsp turmeric and salt to your taste. Mix well.; Then add your mashed potatoes and black pepper. Mix well, taste, and adjust salt and pepper if needed.; Then add your mashed potatoes and black pepper. Mix well, taste, and adjust salt and pepper if needed.; Finally, add lime juice. Adjust seasonings to your taste. Mix everything really well together until the mixture becomes quite lumpy. Leave the cutlet mixture to cool down.; Finally, add lime juice. Adjust seasonings to your taste. Mix everything really well together until the mixture becomes quite lumpy. Leave the cutlet mixture to cool down.; When the mixture is cooled down, take 2-3 tbsp of the cutlet mixture (depending on how big or small you want) at a time and make them into small cutlet balls. Make sure the surface of the cutlet ball is smooth. (read the description for more info). Arrange them on a plate.; When the mixture is cooled down, take 2-3 tbsp of the cutlet mixture (depending on how big or small you want) at a time and make them into small cutlet balls. Make sure the surface of the cutlet ball is smooth. (read the description for more info). Arrange them on a plate.; Make a lump-free batter by mixing flour, salt, and water together. You may need to adjust the amount of water that goes in. The batter should be thick and it should coat the cutlet balls really well. If the batter is too runny then add more flour. If the batter is too thick, then add some water.; Make a lump-free batter by mixing flour, salt, and water together. You may need to adjust the amount of water that goes in. The batter should be thick and it should coat the cutlet balls really well. If the batter is too runny then add more flour. If the batter is too thick, then add some water.; Now dip one ball at a time in the batter. Use a fork to easily handle. Hold the cutlet over the mixture for a few seconds so the excessive batter can drip down.; Now dip one ball at a time in the batter. Use a fork to easily handle. Hold the cutlet over the mixture for a few seconds so the excessive batter can drip down.; Transfer it to the breadcrumbs plate and cover the cutlet completely with breadcrumbs.; Transfer it to the breadcrumbs plate and cover the cutlet completely with breadcrumbs.; Roll the cutlet between your hands so the breadcrumbs stick to the cutlet better. If you use very fine breadcrumbs make sure to double coat the cutlets by dipping them again in the batter and cover with breadcrumbs.; Roll the cutlet between your hands so the breadcrumbs stick to the cutlet better. If you use very fine breadcrumbs make sure to double coat the cutlets by dipping them again in the batter and cover with breadcrumbs.; Arrange the cutlets on a plate and refrigerate them for about 1 hour or until you’re ready to fry them. Let the batter dry out so the breadcrumbs stick to the cutlets better.; Arrange the cutlets on a plate and refrigerate them for about 1 hour or until you’re ready to fry them. Let the batter dry out so the breadcrumbs stick to the cutlets better.; Heat the oil (350F). When you put a piece of breadcrumb coated batter it should bubble up and quickly reach the surface of the oil when your oil is heated enough. Add about 3 cutlets at a time into the hot oil. Leave the cutlets for about 20 seconds untouched. And then roll/flip them carefully from time to time to ensure that they evenly fry. When the cutlets are golden, lay them on a paper towel to remove excess oil. (Read the description for more info about frying cutlets.); Heat the oil (350F). When you put a piece of breadcrumb coated batter it should bubble up and quickly reach the surface of the oil when your oil is heated enough. Add about 3 cutlets at a time into the hot oil. Leave the cutlets for about 20 seconds untouched. And then roll/flip them carefully from time to time to ensure that they evenly fry. When the cutlets are golden, lay them on a paper towel to remove excess oil. (Read the description for more info about frying cutlets.)",0.0,0.0,0.0,0.0,63.9
201,Simple Spicy Beef Fry,"Cut the beef into roughly 1 - 11/2 inch thick pieces.; Cut the beef into roughly 1 - 11/2 inch thick pieces.; Add all the ingredients under “To pressure cook beef” to the pressure cooker (read the description for alternative methods) and mix well together.; Add all the ingredients under “To pressure cook beef” to the pressure cooker (read the description for alternative methods) and mix well together.; Close with the lid and pressure cook for 2 whistles (or 20 mins in an instant pot). Let the pot cool down and naturally depressurize. This how it looks like when the beef is cooked. You’d have some liquid from the beef but that’s okay.; Close with the lid and pressure cook for 2 whistles (or 20 mins in an instant pot). Let the pot cool down and naturally depressurize. This how it looks like when the beef is cooked. You’d have some liquid from the beef but that’s okay.; Turn up the heat and cook uncovered until most of the water has evaporated. Make sure the bottom is not burning.; Turn up the heat and cook uncovered until most of the water has evaporated. Make sure the bottom is not burning.; Now, heat a large frypan and add about 1 tbsp of coconut oil. Add ¼ tsp of cumin seeds and let them sizzle in the oil. Then add your curry leaves and let them splatter.; Now, heat a large frypan and add about 1 tbsp of coconut oil. Add ¼ tsp of cumin seeds and let them sizzle in the oil. Then add your curry leaves and let them splatter.; Lower the heat and immediately add your cooked beef. If there’s any gravy left add that too to the pan.; Lower the heat and immediately add your cooked beef. If there’s any gravy left add that too to the pan.; On medium-high heat fry the beef pieces until they become nice and brown. Make sure you flip them from time to time so all the pieces get evenly brown on all the sides.; On medium-high heat fry the beef pieces until they become nice and brown. Make sure you flip them from time to time so all the pieces get evenly brown on all the sides.; Add the chili flakes, salt to taste, mix well and turn off the heat.; Add the chili flakes, salt to taste, mix well and turn off the heat.; Add your onion rounds or slices and stir with the beef. It’s better when they remain nice and crunchy.; Add your onion rounds or slices and stir with the beef. It’s better when they remain nice and crunchy.; Add some lime juice to your taste and mix well. (optional step); Add some lime juice to your taste and mix well. (optional step)",0.0,0.0,0.0,0.0,63.9
202,Sri Lankan Creamy Potato Curry,"Wash and peel the medium size potatoes (a waxy type like Yukon gold potatoes is preferred). Cut them into quarters or to 6 pieces of your potatoes are on the bigger side. Make sure all the potatoes are roughly equal in size.Then put them into a deep saucepan or a pot.; Wash and peel the medium size potatoes (a waxy type like Yukon gold potatoes is preferred). Cut them into quarters or to 6 pieces of your potatoes are on the bigger side. Make sure all the potatoes are roughly equal in size.; Then put them into a deep saucepan or a pot.; Add all the ingredients except water, thick coconut milk, and lime juice.; Add all the ingredients except water, thick coconut milk, and lime juice.; Then add your water and mix well. You might want to adjust the amount of water depending on the vessel and the number of potatoes you use.; Then add your water and mix well. You might want to adjust the amount of water depending on the vessel and the number of potatoes you use.; Cook covered until the potatoes are fork-tender. This means you should be able to poke the potatoes with a fork without much resistance. It's okay to have about ¼ cup of water left. If you have more water than that then crank up the heat and leave the pot uncovered and let the water evaporate. If your potatoes are still not cooked and all your water has evaporated then add some water, cover the pot, and cook until potatoes are done. Do not overcook your potatoes otherwise, they would become mush. So keep an eye on them and check the doneness of your potatoes from time to time.; Cook covered until the potatoes are fork-tender. This means you should be able to poke the potatoes with a fork without much resistance. It's okay to have about ¼ cup of water left. If you have more water than that then crank up the heat and leave the pot uncovered and let the water evaporate. If your potatoes are still not cooked and all your water has evaporated then add some water, cover the pot, and cook until potatoes are done. Do not overcook your potatoes otherwise, they would become mush. So keep an eye on them and check the doneness of your potatoes from time to time.; Now lower the heat and add your thick coconut milk.; Now lower the heat and add your thick coconut milk.; Mix gently without breaking your potatoes. Bring the coconut milk to simmer. And then keep gently mixing the curry continuously for about 5 mins without breaking potatoes so your coconut milk wouldn't curdle. Make sure you taste the curry and adjust the salt too.; Mix gently without breaking your potatoes. Bring the coconut milk to simmer. And then keep gently mixing the curry continuously for about 5 mins without breaking potatoes so your coconut milk wouldn't curdle. Make sure you taste the curry and adjust the salt too.; Turn off the heat and keep stirring it gently until the curry cools down a little bit.; Turn off the heat and keep stirring it gently until the curry cools down a little bit.; Then squeeze a few drops of lime juice. (this step is totally optional) it thickens up the curry just a little bit more, helps to cut through the creaminess.; Then squeeze a few drops of lime juice. (this step is totally optional) it thickens up the curry just a little bit more, helps to cut through the creaminess.",0.0,0.0,0.0,0.0,63.9
203,Sausage / Hot dog Stir-fry,"Heat oil in a pan. Add curry leaves and chopped garlic. Mix and then add finely chopped onion. Mix well and add chopped tomatoes and a bit of salt. Cook until tomatoes get mushy.; Heat oil in a pan. Add curry leaves and chopped garlic. Mix and then add finely chopped onion. Mix well and add chopped tomatoes and a bit of salt. Cook until tomatoes get mushy.; Then add your sausages/hot dog pieces and black pepper and mix really well. Saute until they get red fry marks.; Then add your sausages/hot dog pieces and black pepper and mix really well. Saute until they get red fry marks.; And then add ¼ cup of water, mix, and cook on medium-high heat until all the water evaporated. (You can also add a little bit of ketchup or chili sauce at this point for more tanginess if it needs); And then add ¼ cup of water, mix, and cook on medium-high heat until all the water evaporated. (You can also add a little bit of ketchup or chili sauce at this point for more tanginess if it needs); Then mix in your thick slices of onion and green chili, mix and turn off the heat. Adjust salt if needed.; Then mix in your thick slices of onion and green chili, mix and turn off the heat. Adjust salt if needed.",0.0,0.0,0.0,0.0,63.9
204,Sri Lankan Spicy Lentil Curry,"Wash your lentils thoroughly to remove all the starch and until water runs clear. Add enough water to soak the lentils and soak them for about 30 mins. You'll see that they turn pale in color and plump up.; Wash your lentils thoroughly to remove all the starch and until water runs clear. Add enough water to soak the lentils and soak them for about 30 mins. You'll see that they turn pale in color and plump up.; Then heat a saucepan or small pot. Add coconut oil. When the oil heats up add mustard seeds. They should sizzle right away. When they start to splatter add your curry leaves, pandan leaves, chopped garlic, and chopped onion. Saute until garlic turns brown and onions turn translucent.; Then heat a saucepan or small pot. Add coconut oil. When the oil heats up add mustard seeds. They should sizzle right away. When they start to splatter add your curry leaves, pandan leaves, chopped garlic, and chopped onion. Saute until garlic turns brown and onions turn translucent.; Then lower the heat and add chili powder, turmeric powder, salt. Mix and saute for a few seconds.; Then lower the heat and add chili powder, turmeric powder, salt. Mix and saute for a few seconds.; Now drain water from your lentils. Add lentils to the pot along with sliced green chilies and mix well with other ingredients.; Now drain water from your lentils. Add lentils to the pot along with sliced green chilies and mix well with other ingredients.; Add water just to cover lentils and stir lightly to mix. (if you didn't soak lentils for 30mins, add a little bit more water); Add water just to cover lentils and stir lightly to mix. (if you didn't soak lentils for 30mins, add a little bit more water); Bring the water to simmer. Then turn the heat to the lowest setting.; Bring the water to simmer. Then turn the heat to the lowest setting.; Cover and cook for 5-10 mins or until lentils are almost cooked through. (Open the lid and mix lightly if the liquid starts to foam and spillover. Then keep it half covered so the steam can escape. You can avoid this by washing lentils very thoroughly before you cook to remove all the starch); Cover and cook for 5-10 mins or until lentils are almost cooked through. (Open the lid and mix lightly if the liquid starts to foam and spillover. Then keep it half covered so the steam can escape. You can avoid this by washing lentils very thoroughly before you cook to remove all the starch); Then add coconut milk and mix. If you need more gravy add more and if you need a dry curry add less than the amount I mentioned.; Then add coconut milk and mix. If you need more gravy add more and if you need a dry curry add less than the amount I mentioned.; Bring it to simmer while lightly mixing. Don't mix too much so the lentils won't break. Taste and add salt if needed. Cook for another minute on low heat and turn the heat off.; Bring it to simmer while lightly mixing. Don't mix too much so the lentils won't break. Taste and add salt if needed. Cook for another minute on low heat and turn the heat off.",0.0,0.0,0.0,0.0,63.9
