recipe_id,title,instructions,calories,protein_g,carbs_g,fat_g,estimated_cost_lkr
1,Make Jackfruit Seed Fry Recipe | Crispy & Easy Vegan Dish,"Take the jackfruit seeds and boil them in water for 10 minutes. Now, let the jackfruit seeds to go room temperature. Then, cut them into half and peel off the skin. Add turmeric powder and salt. Mix them well. Heat the oil and fry jackfruit seeds until they start to turn golden. For me, it takes about 5 minutes under high flame. Finally, add some chili powder and mix well till all are combined. This is how to make the best Sri Lankan jackfruit seeds fry recipe at home. Serve and enjoy these deep-fried crispy and spicy jackfruit seeds.",1018.1,6.8,47.7,93.2,190.4
2,Simple Bitter Gourd Fry with Curd Sambol Recipe (KETO),"Rinse the bitter gourd and cut it into thin round pieces. Take off the middle part along with the seeds. Also, chop the onions, coriander leaves, and green chilies. Besides, take turmeric powder, curd, salt, and cooking oil. Add turmeric powder and salt to the bitter gourd. Mix those well until all are combined. Heat the oil and fry the bitter gourd pieces to a golden brown. For me, it takes about 10 minutes under high flame. Now take a large bowl and add onion, green chili, coriander leaves, curd, and salt. Mix them well. Finally, add fried bitter gourd pieces and mix everything till combined. This is how to make a simple bitter gourd fry with curd sambol recipe. Serve and enjoy this Sri Lankan healthy pavakkai or Karawila fried salad.",976.5,6.8,37.3,92.5,288.5
3,Ash Gourd Curry Recipe (Puhul/Wax Gourd/Winter Melon),"Take the ash gourd, peel off its skin, and cut off the part of the seed. Rinse and cut it into medium-sized pieces. Besides, cut the onion, green chilies, and dried red chilies. Additionally, prepare the coconut milk and take some water. Also, prepare with curry leaves, turmeric powder, salt, mustard seeds, and cooking oil. Now, place the skillet on the stove and add the ash gourd. On top of that, add green chili, ¼ parts of the onion, turmeric powder, salt, and water. Give a good mix. Cook covered under a high flame until all the liquid evaporates. Halfway through, take off the lid and give a good stir. For, me it takes about 10 minutes. Now, add coconut milk and give a mix. Cook covered under medium flame for about three minutes. Adjust salt if needed. Once done, switch off the flame and leave it aside for final preparation. Heat the oil and add mustard seeds. Let them splutter. Then, add the rest of the onion, curry leaves, and dried red chili. Sauté them until the onion turns golden. Finally, add the prepared ash gourd curry, give a gentle mix, and switch off the flame. This is how to cook the best and most tasty ash gourd curry recipe at home. Serve and enjoy this Sri Lankan Puhul curry recipe.",1323.0,26.6,69.8,111.4,283.0
4,Easy Chana Masala Recipe for Chapathi (No Coconut Milk),"Take the chickpeas and soak them overnight in the water. Then wash them thoroughly at least 2 or 3 times. Now add chickpeas, salt, and water to a pressure cooker and cook them until chickpeas turn tender. I leave them to cook until 10 whistles. Once done, leave the pressure cooker to remain covered until it comes to room temperature. Then open the lid and strain the water completely using a colander. Besides, finely chop the onion and coriander leaves. Also, slice the green chilies, dice the ginger garlic, and blend the tomatoes to a puree. Apart from that, get ready with water, curry powder, bay leaf, cloves, turmeric powder, fennel seeds, and salt. Now heat the oil and add green chilies, bay leaf, cloves, and fennel seeds. Sauté them 30 seconds. Then, add onion and sauté them till it turns translucent. After that, add diced ginger garlic and sauté them till the onion starts turning golden. Then, add tomato puree and salt. Mix and cook covered under low flame for five minutes. Now add curry powder, turmeric powder, and water. Give a good mix and cook covered under high flame for three minutes. Now, add the boiled chickpeas and mash them a bit until you get thick gravy as you want. Taste the gravy and adjust salt if needed. Finally, add the coriander leaves and give a good mix. This is how to make an easy Chana Masala recipe for chapathi without coconut milk. Serve and enjoy this delicious Sri Lankan Chana Masala.",1499.0,33.0,154.5,94.6,515.3
5,Make Tomato Sodhi Recipe | Easy & Quick Vegan Sothi | KETO,"Cut the tomato into medium size pieces. Also, slice the green chilies and chop the onions. Besides, get ready with lime, curry leaves, fenugreek seeds, turmeric powder, and salt. Prepare the thin and thick coconut milk. In a cooking pot add tomato, turmeric powder, fenugreek seeds, salt, onion, curry leaves, green chilies, and thin coconut milk. Give a mix and switch on the flame. Cook covered under high flame for about five to six minutes. If the milk foams up reduce the flame and give a good stir. Now add the thick coconut milk and cook uncovered under medium flame for about two minutes. Stir occasionally to avoid foaming. Finally, switch off the flame and add the lime juice. Also, taste and adjust salt if needed. This is the easy and best way to make Tomato Sodhi recipe. Serve and enjoy this Sri Lankan style vegan sothi.",1218.5,40.1,180.3,52.6,296.5
6,[Fried] Eggplant Potato Tomato Curry Recipe | Brinjal Aloo Curry,"Clean, rinse, and cut eggplants, potatoes, tomatoes, and banana peppers into large pieces. Also, slice the garlic and chop the onion. Besides, get ready with mustard seeds, fenugreek seeds, curry powder, turmeric powder, salt, and curry leaves. In addition, prepare thick coconut milk, thin coconut milk, and tamarind juice. Heat the oil and fry eggplant, potato, and banana pepper separately. Before fry, add some salt to each vegetable and mix. Fry them until starts turn golden. For me, it takes about five minutes to eggplant, five minutes to potato, and four minutes to banana pepper under high flame. Heat the oil and add mustard seeds. Let them splutter. Then, add onion and curry leaves. Sauté them till onion turn translucent. Now, add garlic and fenugreek seeds. Sauté them till the onion turns to a golden brown. Now add the tomatoes, turmeric powder, salt, curry powder, tamarind juice, and thin coconut milk. Give a good mix. Cook covered under high flame for six minutes. Now add the fried vegetables and thick coconut milk. Give a good gentle mix. Cook covered under low flame for about five minutes. Taste the curry and adjust salt if needed. This is how to make a delicious eggplant potato tomato curry recipe at home. Serve and enjoy this Sri Lankan style spicy brinjal Aloo tomato curry.",1532.5,37.5,97.2,120.4,651.9
7,How to Make Onion Achcharu in Jaffna? (Best & Simple),"Peel the shallots and get ready with all other ingredients as above. Firstly, wash all the vegetables. Then cut the carrot, banana pepper, and butter bonchi. Also, cut the tail part of green chilies. Put everything along with the onions on a flat surface and dry them for one or two hours. We usually dry them under the sunlight. If that’s hard dry them under the fan. Grind mustard seeds, dried red chilies, ginger, garlic, 50g of dates, and vinegar to a paste. (You don’t need to grind them to a smooth paste) Then, add sugar and salt to it. Mix them well. So now you have the ground paste, 150g of dates, and dried vegetables. Put everything in a large container and mix them well until all are combined. Once done, leave them in the same container for four to five hours. Then, again give a good mix and put them in an air-tight glass bottle for everyday use. This is how to make onion achcharu in Jaffna style. Serve and enjoy this best onion achcharu with rice/pittu/string hoppers and curries.",1675.1,18.0,157.0,112.2,305.0
8,Simple Agathi Keerai Sodhi Recipe (Healthy | KETO),"Take the Agathi keerai and wash them thoroughly. Also, prepare coconut milk, tamarind juice, and take some water. Additionally, get ready with chopped onions, sliced green chilies, turmeric powder, and salt. Take a skillet and place the Agathi keerai in it. On top of that, add onions, green chilies, turmeric powder, salt, tamarind juice, and water. Cook covered under high flame for five minutes. Take off the lid, give a good mix, and again cook covered under high flame for about three minutes. Now add the coconut milk and cook uncovered under high flame for one or two minutes. Stir occasionally to avoid foaming the milk. Taste the Sodhi and adjust salt if needed. This is how to make a simple Agathi keerai Sodhi recipe at home. Serve and enjoy this Sri Lankan style traditional Agathi keerai Sodhi.",583.5,8.1,45.7,43.6,233.4
9,Simple Eggplant Milk Curry Recipe (Kathirikai Paal Curry),"Take the eggplant, cut it into medium sized pieces, and rinse it well. Chop the onions and slice the green chilies and garlic cloves. Also, take the curry leaves, turmeric powder, salt, and water. Besides, get ready with thick coconut milk. (Refer Note 1) Place the cooking pot over the stove. Add the pieces of eggplant, onions, green chilies, garlic cloves, curry leaves, salt, and turmeric powder. Switch on the flame and add the water. Mix everything well. Cook covered under the high flame for 4 to 6 minutes. Take off the lid, stir and mix everything. Again cook covered under high flame until all the water disappears. For me, it takes about 4 minutes. Now take off the lid and turn the flame to low. Mash the eggplant using a spoon for 1 minute. Add the thick coconut milk and mix well. Cook covered under low flame for 2 to 4 minutes. Take off the lid and taste the curry. Adjust salt if needed. (Refer Note 3) Serve and enjoy this Sri Lankan style easy eggplant milk curry recipe or Kathirikai paal curry.",613.5,12.2,45.5,46.2,241.3
10,Make Sri Lankan Pumpkin Curry Recipe | Poosanikai Kootu,"Take the pumpkin, rinse it well, and cut it into medium-sized pieces. Also, chop the onions and dry red chilies. Additionally, slice the green chilies and get ready with garlic, curry leaves, mustard seeds, cumin seeds, black pepper, turmeric powder, and salt. Prepare the thick coconut milk and take some water. Grind cumin seeds, black pepper, and garlic together to a paste. You don’t need to grind them to a smooth paste. Now, place the cooking skillet over the stove and put the pumpkin pieces in it. On top of that, add green chilies, 20% of the chopped onion, turmeric powder, salt, and water. Give a good mix. Cook covered under high flame for 10 minutes. Open the lid, give a good stir, and again cook covered under the high flame until all the liquid evaporates and the pumpkin turns tender. For me, it takes about 5 minutes. Now, mash the pumpkin pieces a bit. Add the ground mixture and coconut milk. Stir and mix well under low flame for a minute. Switch off the flame and keep it aside for final preparation. Heat the oil in a deep-fried pan and add mustard seeds. Let them splutter. Then, add the curry leaves and dried red chilies. Sauté those for 30 seconds and then add the remaining 80% of onions. Sauté those until onions start to turn golden. Now, add this fried mix to the pumpkin curry. Mix well until all combined. Taste the curry and adjust salt if needed. This is how to make a Sri Lankan pumpkin curry recipe with coconut milk. Serve and enjoy this delicious pumpkin curry recipe.",1597.0,38.8,108.6,126.7,432.3
11,Green Chilli Coconut Sambal (Pol Sambol) Recipe | KETO,"Get ready with grated coconut, onions, green chilies, thick tamarind juice, sugar, and salt. Clean the mortar and pestle. Add green chilies and salt together. Using the pestle bash and muddle them to a fine/medium textured paste. For me, it takes about 4 minutes. Now add the tamarind juice and bash them for a minute. Then add grated coconut and sugar. Bash and muddle them until all combined well. For me, it takes about 3 minutes. Finally, add the onions and bash them for one or two minutes. You don’t have to bash the onions to smooth texture, because this green chilli coconut sambal is tastier when onion pieces locate here and there. This is how to make the best green chilli coconut sambal recipe at home. Serve and enjoy this keto-friendly green pol sambol.",558.0,8.5,79.4,48.2,99.0
12,Best Jaffna Mutton Rolls Recipe Homemade (Step by Step Pics),"Rinse the mutton and cut it into tiny pieces. Also, cut the potato into small pieces. Besides, chop the onion, ginger, curry leaves, and green chilies. Apart from all, get ready with lime, curry powder, turmeric powder, salt, and cooking oil. Heat the oil and add half of the onion. Sauté them till translucent. Then add green chilies and curry leaves. Sauté them till onion starts turn to golden. Now, add the mutton, turmeric powder, and salt. Give a good mix. Cook covered under high flame for 5 minutes. Add potato and curry powder. Give a good mix. Cook covered under medium flame until all the liquid evaporates. For me, it takes about 10 minutes. Taste a piece of mutton, if it is not cooked well enough add some water and cook again. Now add the rest of the onion and ginger. Stir, mix and cook for one or two minutes under medium flame. Finally, switch off the flame and squeeze the lime. Also, adjust salt if needed and give one last good mix. This is how to make the best spicy typical Jaffna style curry for mutton rolls. Take a large bowl, add all-purpose flour and salt. Mix them well. Add the water little by little while mix them using a whisk. Mix well until all dissolved thoroughly. For me, it takes about 10 minutes. Take ¾ of the smooth batter for making the dosa (wrapper) and leave the rest for dipping the rolls. Heat the dosa pan and make dosa. You don’t need to flip the dosa. Cook one side is enough to make the rolls. Now put the curry on top of the dosa and make the rolls. Do the same until you finish the mutton curry. Take the breadcrumbs and the rest of the smooth batter. Dip each roll inside the batter and then coat them with the breadcrumbs. Do the same to all the rolls you made. Now heat the oil in a deep frying pan and fry the rolls under the high flame until they turn golden brown. For me, it takes about 4 minutes for each batch. This is how to make the best Jaffna mutton rolls without frozen wrappers. Serve and enjoy these typical Jaffna-style soft and crispy mutton rolls.",1687.5,24.3,103.2,141.5,677.9
13,How to Make Apple Toffee | Unique Sri Lankan Sweet,"Get ready with full cream powder, sugar, butter, grated coconut, water, ground cardamom, vanilla extract, food coloring, and cloves. Add full cream milk powder and grated coconut in a large bowl. Mix them well. Place a large skillet in a stove and switch on the flame. Add sugar and water. Boil them until all the sugar dissolves and white bubbles come out. Stir occasionally. Add butter and stir frequently under high flame for about 30 seconds or all the butter dissolves well enough. Now add the full cream milk powder-grated coconut mix. Cook uncovered under low flame for about 3 to 4 minutes. Mix and stir frequently to avoid burning. Finally, add the food coloring, vanilla extract, and ground cardamom. Cook under very low flame for about a minute and then switch off the flame. Mix and stir frequently to avoid burning. Now rub some butter in your both palms. Then, take a small portion from the dough and mold into round mini-balls like the size of cherry fruit. Insert a clove for each tinny ball. This is how to make apple toffee sweet recipe at home in Sri Lankan style. Serve and enjoy these unique delicious sweets.",944.0,13.9,73.7,56.8,113.6
14,Simple Spring Onion Flower Recipe | Vengaya Thal Poo Varai,"Take the spring onions flower/Vengaya thal poo Chop that into small pieces. Wash it well at least 2 or 3 times. (Refer Note 1) Chop the onion and green chili. Also, get ready with grated coconut, turmeric powder, and salt. (Refer Note 2) Add the chopped spring onion flower in the cooking pan. Also, add green chili, onion, salt, and turmeric powder. Now add one tablespoon of cooking oil. Mix them well and switch on the flame. Cook covered under the high flame for 3 to 5 minutes. Open the lid and cook uncovered under medium flame until the spring onion flower gets little fry. During this time you may stir and mix occasionally to avoid burn. For me, it takes 4 minutes. Finally, add grated coconut, mix, and cook uncovered under low flame for one minute. Taste the curry and add salt if needed. Serve and enjoy this Sri Lankan style simple spring onion flower recipe with grated coconut.",514.5,5.3,33.6,42.2,329.7
15,Sri Lankan Fish Sothi with Mango Recipe | Meen Sothi,"Cut the fish into your desired size pieces and wash it well. Take a green mango, wash it, and cut into small pieces. Take some curry leaves, slice the onions, slice the green chilies and keep it aside. Place the cooking pot on a stove. Add fish and mango. Then add sliced onions, green chilies, and curry leaves. Also, add turmeric powder and salt as you need. Add the thin coconut milk and mix it well. Now switch on the flame and close the pan with the lid. Cook covered under medium flame for about 10 minutes till the slices of mango turn to tender. Now take off the lid and add thick coconut milk. Stir the liquid frequently for 2 to 3 minutes. Taste the sothi and add salt if needed. This is how to make Sri Lankan fish sothi with mango recipe. Serve and enjoy this delicious fish dish.",1087.0,29.0,86.7,73.1,517.6
16,Ammikallu Red Coconut Sambol | Jaffna Traditional Pol Sambal,"Grate the coconut and peel off the skin of shallots. Besides, get ready with dried red chili, tamarind, sugar, salt, and water. Clean the grinding stone and roller. Firstly, add dried red chilies, salt, and a little water (About a teaspoon of water). Grind them to a smooth paste by moving the roller back and forth direction. Now, add tamarind, bash a bit using the roller, and take out the seeds carefully. Again move the roller back and forth direction for 1 or 2 minutes. Then, add sugar and move the roller until all combined. Add the grated coconut and move the roller back and forth direction until totally mixed. For me, it takes about 5 minutes. Finally, add the shallots and bash them a bit. Again move the roller back and forth direction until all combined. In the end, using your fingers take off all the coconut sambol. This is how to make the best and tasty Ammikallu Red coconut sambol recipe.",560.0,2.1,53.1,49.6,105.4
17,Green Bean Coconut Milk Curry | Sri Lankan Bonchi Recipe,"Take the green bean and wash it thoroughly. Cut them into 2-inch pieces. Chop the onions and slice the green chilies. Also, get ready with curry leaves, turmeric powder, and salt. Prepare 100ml of thick coconut milk. Also, get ready with 75ml of water. Heat the oil in a cooking pan and add the onion. Sauté it until it gets translucent. Then add green chilies and curry leaves. Stir and cook for a minute. Now add the sliced green bean, mix well, and cook covered under low flame for 2 or 3 minutes. Take off the lid. Add turmeric powder, salt, and water. Mix everything well. Cook covered under medium flame for 2 minutes. Take the lid off and add thick coconut milk. Mix well. Again cook covered under low flame for 2 minutes. Taste the curry and adjust salt if needed. This is how to make the best green bean coconut milk curry recipe. Serve and enjoy this delicious Sri Lankan bonchi curry.",1367.5,7.2,19.5,144.3,310.4
18,Sri Lankan Cabbage Potato Curry Recipe with Coconut Milk,"Rinse the cabbage and shred it into tiny pieces. Also, peel off the potato skin and cut it into small pieces. Additionally, chop the onion and green chili. Besides, prepare the coconut milk and get ready with curry leaves, turmeric powder, and salt. Now, place a large skillet on the stove and put the cabbage in it. On top of that, add potato, onion, green chili, curry leaves, turmeric powder, salt, and cooking oil. Give a good mix and switch on the flame. Cook covered under high flame for 7 minutes. Take off the lid, give a good stir, and again cook covered under medium flame until potato pieces turn tender. For me, it takes about 7 minutes. Now, add thick coconut milk and mix well. Cook covered under medium flame for 2 minutes. Taste the curry and adjust salt if needed. This is how to prepare the best Sri Lankan cabbage potato curry recipe. Serve and enjoy this simple cabbage potato milky curry.",578.5,10.4,38.8,45.8,317.6
19,Best Bitter Gourd Sambol Recipe | Pavakkai/Karawila Fried Salad,"Rinse the bitter gourd and cut it into thin round pieces. Take off the middle part along with the seeds. Also, chop the onions and green chilies. Besides, prepare the coconut milk and tamarind juice. Additionally, take sugar, turmeric powder, salt, and cooking oil. Add turmeric powder and salt to the bitter gourd. Mix those well until all combined. Heat the oil in a deep-fry pan and fry the bitter gourd pieces to a golden brown. For me, it takes about 10 minutes under high flame. Now take a large bowl and add onion, green chili, coconut milk, tamarind juice, sugar, and salt. Mix them well. Finally, add fried bitter gourd pieces and mix everything until totally combined. This is how to make the best bitter gourd sambol recipe. Serve and enjoy this Sri Lankan pavakkai or Karawila fried salad.",965.0,5.8,35.5,92.3,305.2
20,Sri Lankan Cassava Curry with Coconut Milk Recipe,"Take the cassava, peel off the skin, rinse well, and cut them into small pieces as shown in the picture below. Chop the onion and slice the green chili. Also, get ready with lime, curry leaves, turmeric powder, fenugreek seeds, and salt. Prepare the coconut milk and take some water. Now place the skillet on the stove and add cassava. On top of that, add turmeric powder, fenugreek seeds, salt, onion, green chili, and curry leaves. Mix them well. Cook covered under high flame for about 10 minutes. Take off the lid, give a good mix, and again cook covered under high flame till cassava turns tender. For me, it takes about 5 minutes. Using a spoon mash the cassava as shown in the picture below. Now add the coconut milk, mix well, and cook uncovered under medium flame for about a minute. Finally, switch off the flame and squeeze the lime. Give one last good mix. Taste the curry and adjust salt if needed. This is how to make the best Sri Lankan cassava curry with coconut milk. Serve and enjoy this simple tapioca milky curry.",911.5,23.2,118.1,46.3,254.9
21,Easy Sri Lankan Chickpea Breakfast | Simple Vegan Kadalai Recipe,"Take the chickpeas and soak them overnight in the water. Then wash them thoroughly at least 2 or 3 times. Now add chickpeas, salt, and water in a pressure cooker and cook them until chickpeas turn tender. I leave them to cook until 8 whistles in the pressure cooker. Once done, leave the pressure cooker to remain covered until it comes to room temperature. Then open the lid and strain the water completely using a colander. Besides, slice the onion, dried red chilies, and curry leaves as shown in the picture below. Also, get ready with mustard seeds and cooking oil. Heat the oil and add mustard seeds. Let them splutter. Then add onion, dried red chili, and curry leaves. Sauté them till onion start turns to golden. Now add the boiled chickpeas and mix them well until all combined. This is how to make an easy Sri Lankan chickpea breakfast recipe. Serve and enjoy this simple vegan chickpeas salad with your friends and family.",1156.0,21.1,33.8,109.6,112.5
22,Best Sambar Recipe without Sambar Powder & Coconut Milk,"Clean and slice the potato, pumpkin, carrot, eggplant, tomato, drumstick, onion, garlic, green chili, dried red chili, and coriander leaves. Besides, rinse the dhal and prepare tamarind juice. Apart from that, get ready with water, curry leaves, turmeric powder, mustard seeds, curry powder, salt, and cooking oil. Heat the oil and add mustard seeds. Let them splutter. Then add onion, green chili, dried red chili, and curry leaves. Sauté them till the onion starts turn to golden. Now, add dhal, garlic, turmeric powder, salt, and water. Give a good mix. Cook covered under the high flame until dhal turns tender. For me, it takes about 20 minutes. Now, add potato, pumpkin, carrot, eggplant, tomato, drumstick, curry powder, and tamarind juice. Give a good mix. Cook covered under the high flame until all the vegetables, especially carrots and potatoes turn tender and soft. For me, it takes about 30 minutes. Taste the curry and adjust salt if needed. Finally, add the coriander leaves and give a good mix. This is how to make the best sambar recipe without sambar powder and coconut milk. Serve and enjoy this simple Sri Lankan mixed vegetable dish.",1263.5,25.4,55.2,111.4,598.7
23,Pazhaya Soru Kanji | Neeragaram | Leftover Rice Recipe,"Take the leftover steamed rice and add water in it. Cover and leave it overnight, at least 8 hours. On the next day morning, take the fermented leftover rice. Besides, chop the onions and green chilies. Apart from that, prepare the coconut milk and take the salt along with lime. Now, smash and squeeze the fermented leftover steamed rice using your fingers. Add onion, green chili, and salt. Again mix, smash, and squeeze everything using your fingers. Finally, add coconut milk and lime. Give one last good mix using a ladle. This is how to make the best Jaffna style pazhaya soru kanji recipe. Serve and enjoy this Sri Lankan healthy neeragaram dish.",677.5,13.0,13.8,67.7,104.3
