recipe_id,title,instructions,calories,protein_g,carbs_g,fat_g,estimated_cost_lkr
101,Shredded Chicken Fried Noodles with Vegetables Recipe,"Boil the noodles and spread it in a flat surface pan. The boiled noodles should be soft and chewy but not mushy or soggy. Take the boneless chicken and cut it into large pieces. Rinse them well and place them in a cooking pot. Add cinnamon, cardamom, ½ teaspoon of turmeric powder, and salt. Mix them well and switch on the flame. Cook covered under medium flame till the chicken turns to tender. For me, it takes about 12 minutes. Once in between takes of the lid and stir to avoid burn. Once done, let the chicken cool down and tear them into small pieces. Keep them aside for fry later. Take the carrot, leeks, banana pepper, and cabbage. Clean and rinse them well. Also, slice them. Slice the onion and take some curry leaves. Also, get ready with ginger paste, garlic paste, salt and ¼ teaspoon of turmeric powder. Heat the oil in a large deep fry pan and add the curry leaves. Fry them for 20 to 30 seconds under high flame. Put them on top of the noodles. Now, fry the onion under high flame till the onions start turns to brown color. For me, it takes about 5 minutes. Once done, put them on top of the noodles. At last, fry the shredded chicken pieces under medium flame till they start turns to little brown color. For me, it takes about 5 minutes. Add them on top of the noodles. Now, heat the oil in a cooking pot and add cabbage. Stir and cook covered under low flame for 2 or 3 minutes. Add carrot, stir, mix, and cook covered under low flame for 2 to 4 minutes. Now add leeks and banana pepper. Stir, mix and cook uncovered under medium flame for 2 to 4 minutes. Stir occasionally to avoid burning. Finally, add garlic paste, ginger paste, salt, turmeric powder. Stir, mix and cook uncovered under low flame for about 1 or 2 minutes. Add this vegetable mixture on top of the noodles. So, now you have the boiled noodles, fried curry leaves, fried onions, fried shredded chicken pieces, and cooked vegetable mixture. Mix them well until all combined. This is how to make shredded chicken fried noodles with vegetables. Serve and enjoy this Sri Lankan style fried chicken noodles without eggs and soy sauce.",1302.8,24.8,107.8,97.1,518.1
102,Spicy Tinned Fish Sandwich Toast Recipe with Potato Masala,"Take the tin fish, open it, drain all the liquid, and take off the fish chunks. Make the dried red chili flakes. Also, get ready with mustard seeds, turmeric powder, salt, and lime. Boil the potatoes and peel off the skin. Also, chop the onions, mince the garlic and chop the curry leaves. Heat the oil in a cooking wok. Add mustard seeds and let it splutter. Then add the onion and curry leaves. Fry them under high flame until the onion has softened and turned translucent for about 3 minutes. Now add minced garlic. Mix and fry them until the onion starts turn to golden color. Now add salt and turmeric powder. Mix and fry them under medium flame for 1 or 2 minutes. Add the tinned fish chunks, dried red chili flakes, and water. Mix everything well and cook covered under low flame for about 5 minutes. Now add the boiled potatoes. Mash the potatoes and tinned fish chunks well enough. Finally, switch off the flame, add lime juice, and give one last good mix. Taste the curry and adjust salt, lime, red chili flakes if needed. Fill the curry between 2 slices of bread. Grease the sandwich toaster with the melted butter. Place the bread inside the sandwich toaster. Close the toaster tightly and toast the bread. Different toasters require different time to toast the bread. For me, it takes about 5 minutes to toast the bread. This is how to make the best spicy tinned fish sandwich toast recipe in Sri Lankan style. Serve and enjoy this bread sandwich toast.",2260.5,46.8,157.3,168.5,636.3
103,Squid Ink Sodhi Recipe Sri Lanka (Kanava/Cuttlefish Ink),"Clean the squid and tear apart the head of the squid from its body. Then carefully take off the ink with its container which is located inside every squid’s body. Get ready with squid's arm, tentacles, and head. Slice the onion, green chili, and garlic. Also, get ready with curry leaves, fenugreek seeds, turmeric powder, salt, and lime. Now add squid ink containers and water in a bowl. squeeze the ink containers and let the water become dark in color. Place the skillet on the stove and add squid's tentacles, arms, and heads. On top of that, add turmeric powder, salt, and black ink water. Mix them well and cook covered under high flame for 5 minutes. Add fenugreek seeds, onion, green chili, garlic, and curry leaves. Cook Covered under high flame for 5 minutes. Finally, switch off the flame and add the lime juice. Give one last good mix. This is how to make the best Sri Lankan squid ink sodhi recipe at home. Serve and enjoy this unique squid ink sodhi.",778.5,30.9,75.3,47.0,262.1
104,Red Coconut Sambol with Maldive Fish | Jaffna Maasi Sambal,"Get ready with grated coconut and crushed Maldives fish. Take dried red chilies, onion, salt, sugar, and lime. Grind dried red chilies and salt together to flakes. Wash the mortar and pestle. Add the grated coconut and ground dried red chili flakes. Bash and muddle them using a pestle until they combined well. Now add sugar and bash them again. Add the onions and bash them to a good mix. Don’t bash them for a long time because sambol will be tastier when onion pieces locate here and there. Taste the sambol and adjust salt if needed. Finally, add the crushed Maldives fish mix them well. Now, take off all the mixture to a plate or bowl. Add the lime juice and mix everything well. Serve and enjoy this Sri Lankan style red coconut sambol with Maldive fish or Maasi Sambal(Tamil).",990.5,25.5,117.6,72.7,384.4
105,Best Tin Fish Curry Recipe without Potatoes (Easy & Spicy),"Open the tin and take off the fish pieces carefully. If they are big, spread them into 2 or 3 pieces. Chop the onion and slice the garlic. Also, get ready with curry leaves, curry powder, mustard seeds, fenugreek seeds, turmeric powder, and salt. (Refer Note 1) Get ready with thin coconut milk and thin tamarind juice. (Refer Note 2) Heat the oil and add mustard seeds. Let it splutter. Add the onion and sauté it until translucent. For me, it takes about 1 minute. Add curry leaves and garlic cloves. Fry them under high flame until the onion starts to turn a golden color. You may stir and mix occasionally to avoid burn. For me, it takes about 3 minutes. Now add the curry powder, turmeric powder, fenugreek seeds, and salt. (Refer Note 1) Add the tamarind juice. Also, add the coconut milk and mix everything well. Cook covered under the high flame for 3 or 4 minutes. Now add the fish pieces and give a good gentle stir. (Refer Note 3) Cook covered under the high flame for 2 to 4 minutes. Open the lid and give a gentle stir. Again cook covered under low flame for 8 to 10 minutes. (Refer Note 4) Taste the curry and adjust salt if needed. This is how to make the best tin fish curry without potatoes. Serve and enjoy this delicious canned fish curry recipe in Sri Lankan style.",1750.0,41.6,99.4,138.4,685.5
106,Tasty Chicken Samosa Recipe with Step by Step Pics | Homemade,"Take the boneless chicken and cut it into large pieces. Rinse them well and add cinnamon, cardamom, turmeric powder, and salt. Mix everything well and place it on the stove. Cook covered under high flame till the chicken turns to tender. For me, it takes about 12 minutes. In a halfway through, or after 6 minutes take off the lid and give a good stir. You don’t need to add water, but if you feel the chicken starts to burn before it cooks well, you need to add some water. Let the chicken cool down before handling. Now tear the chicken into small pieces. Heat the oil in a deep fry pan and fry the chicken pieces under high flame. Fry them till it turns into little brown. For me, it takes about 5 minutes. Dice the onion, green chilies, garlic cloves, and curry leaves. Also, dice the potatoes. Get ready with chili powder, mustard seeds, salt, and water. Heat the oil and add the mustard seeds. Let it splutter. Now add half of the onion and keep the rest aside for final preparation. Fry the onion under medium flame till it turns into translucent. For me, it takes about 2 minutes. Add garlic, curry leaves, and green chilies. Mix and fry them under medium flame until the onion start turns to brown color. Now add potato, chili powder, and salt. Also, add the water and mix them well. Cook covered under low flame until all the water disappears. For me, it takes about 5 minutes. Now add the fried chicken pieces and rest of the onion. Mix and cook uncovered under low flame for 1 or 2 minutes. Stir and mix constantly to avoid burn. Taste the curry and adjust salt if needed. Now take the spring roll paper and cut them into three symmetric pieces. If you use 20 spring roll papers, you will get 60 sheets after cut them into symmetric pieces. I used two sheets for each samosa. Hence, I made 30 samosas. Make the samosas. Heat the oil in a deep fry pan and add samosas. Fry them until the outer layer gets light brown color. Let the cooking oil gets maximum heat before place the samosas in it. This is the tastiest way to make chicken samosa recipe. Serve and enjoy this Sri Lankan style crispy chicken samosa.",1272.6,24.5,57.9,111.9,387.7
107,Spicy Egg Curry Recipe for Rice | Simple Muttai Kuzhambu,"Boil the eggs and cut it into the half. (Refer Note 1) Slice the onions and garlic cloves. Get ready with curry leaves, turmeric powder, fenugreek seeds, salt, and curry powder. (Refer Note 2 and Note 3) Extract thin coconut milk from grated coconut. Also get ready with thin tamarind juice. (Refer Note 4) Heat the oil in a cooking pan and add the onions. Sauté the onion until it gets translucent. Add garlic cloves, curry leaves, and fenugreek seeds. Stir and cook until the onion starts turn into golden color. Add coconut milk. Now, add tamarind juice. Add salt, turmeric powder, and curry powder. Mix everything well. Cook covered under medium flame for 3 to 5 minutes. Keep the eye on the cooking pot as the liquid gravy may foam up. Take off the lid, stir and mix. Again cook covered under medium flame for 2 to 4 minutes. Now, take off the lid and add the boiled eggs. Cook uncovered under medium flame for 1 or 2 minutes. Once you add the boiled eggs, give a good care when you stir as the yolk part of the egg can easily separate from the white part. Taste the gravy and adjust salt if needed. Serve and enjoy this Sri Lankan style simple and spicy egg curry recipe with coconut milk for rice.",1407.5,23.5,128.0,99.1,416.7
108,"Best Chicken Fried Rice Recipe without Egg, Peas, & Soy Sauce","Take the basmati rice and wash it. Add little oil and salt when you cook the rice. The cooked rice should be soft but not mushy or sticky. Once the rice cooked, put it on a flat surface container and spread it well. (Refer Note 1) Take the boneless chicken, cut it into large pieces, and rinse them well. Also, get ready with cinnamon, cardamom, ½ teaspoon of turmeric powder, and salt. Place the cooking pot on the stove and place the chicken pieces, cardamom, cinnamon, turmeric powder, and slat. Mix them until totally combined and switch on the flame. Cook covered under high flame until the chicken cooked enough. In a halfway through, open the lid and give a good stir. For me, it takes about 12 minutes. (Refer Note 2) When the heat goes down, tear the chicken into small pieces. Take carrot, green bean, and leeks. Clean and wash them well. Also, slice the carrot, chop the green bean, and chop the leeks. Slice the onions and take one or two sprigs of curry leaves. Also, get ready with, garlic paste, ginger paste, ¼ teaspoon of turmeric powder, and salt. (Refer Note 3) Heat the oil and fry the curry leaves under the high flame for 30 seconds. Put it on top of the rice. Fry the onions under high flame until it turns to golden color. For me, it takes about 5 minutes. Once it has done, put it on top of the rice. Fry the chicken pieces under medium flame until it starts to turn to golden color. For me, it takes around 5 minutes. Once done, put it on top of the rice. (Refer Note 4) Now, heat some cooking oil in a pot and add green bean. Cook covered under low flame for 2 or 3 minutes. Add the carrot and mix them. Cook covered under low flame for another 2 or 3 minutes. Now, add the leeks, mix, and cook uncovered under medium flame for 2 or 3 minutes. You should stir occasionally to avoid burn. Finally, add garlic paste, ginger paste, ¼ teaspoon of turmeric powder, and salt. Stir, mix and cook uncovered under low flame for 1 minute. Stir constantly to avoid burn. Once you have done with the vegetable mixture, put that on top of the rice. So, now you have the boiled rice, fried curry leaves, fried onions, fried shredded chicken pieces, and the vegetable mixture. Mix until everything combined well. This is how to make the best chicken fried rice recipe without eggs, peas, and soy sauce. Serve and enjoy this delicious simple chicken fried rice in Sri Lankan style.",1757.3,41.7,167.7,116.6,412.1
109,Easy Pork Curry with Coconut Milk Recipe (Spicy & Tasty),"Take the pork and cut it into small pieces. Add turmeric powder, salt, and water. Rinse it well. Repeat the same for one more time. (Refer Note 1) Drain all the water and add turmeric powder and salt. Mix it well and leave it to marinate for 15 to 30 minutes. Get ready with sliced onions, curry leaves, lime, curry powder, mustard seeds, fennel seeds, and coconut milk. (Refer Note 2 and Note 3) Heat the oil and add mustard seeds. Let it splutter. Add the onions and sauté it until it gets soft and translucent. Add fennel seeds and curry leaves. Stir and cook until the onion turns into golden color. Now, add the marinated pork. Add the water and mix everything well. Cook covered under the high flame for 13 to 15 minutes. Take off the lid, stir and mix everything. Cook covered again under high flame until all the water disappears. For me, it takes about 5 minutes. Now, take off the lid, cook uncovered and stir occasionally until the pork gets frying. Add curry powder and coconut milk. (Refer Note 3) Mix everything well and cook covered under low flame for 5 to 7 minutes. (Refer Note 4) Finally, switch off the flame, add lime juice and mix everything. Taste the gravy and add salt if needed. Serve and enjoy this delicious and easy pork curry with coconut milk recipe in Sri Lankan style.",1430.0,31.3,83.2,118.5,672.0
110,Whole Fish Fry with Bread Crumbs Recipe | Deep Fry Meen Poriyal,"Take the fishes, clean, and rinse thoroughly. Place them in the pan. Add turmeric powder, curry powder, and salt. Add the tamarind juice and water. Mix everything well and switch on the flame. (Refer Note 1) Cook uncovered under high flame until the fish gets boiled and all the water disappears. For me, it takes about 10 minutes. During this time period, in the halfway through, turn the fishes to the next side. Let the fishes cool down. Now take the all purpose flour and add salt to it. (Refer Note 2) Add water time to time and mix well using your fingers. Make a smooth and thick liquid batter. Carefully take off the fishes from the pan and soak it into the batter you prepared. Now coat the fish with the breadcrumbs. Do the same process to all the boiled fishes. Heat the oil in a deep fry pan and fry the fishes under medium flame until it turns to golden color. Serve and enjoy this Sri Lankan style whole fish fry with bread crumbs recipe.",1272.0,35.3,73.8,95.6,480.8
111,How To Make Spicy Crab Curry Recipe (Easy & Tasty Nandu Kuzhambu),"Take the crabs, clean, and rinse it well. (Refer Note 1) Chop the onion, slice the garlic, and mince the ginger. Also take some curry leaves as well. Get ready with curry powder, turmeric powder, fenugreek seeds, and salt. (Refer Note 2) Extract thin coconut milk from grated coconut and get ready with thin tamarind juice. (Refer Note 3) Heat the oil in a cooking pan and add onions. Sauté it until it gets soft and translucent. Add garlic and curry leaves. Stir and fry for about one minute. Add fenugreek seeds. Stir and cook until the onion gets a golden color. Now add the cleaned crabs. Add tamarind juice. Add salt, turmeric powder, and curry powder. Now add the coconut milk. Mix everything well. Cook covered under the high flame for 7 to 9 minutes. Open the lid and mix well. Again cook covered under low flame for 5 to 7 minutes. Taste the gravy and adjust salt if needed. Finally, switch off the flame and add the minced ginger. Mix one last time. This is how to make spicy crab curry. Serve and enjoy this delicious spicy crab curry in Sri Lankan style.",1493.0,33.8,130.0,103.0,416.4
112,How To Make Jaffna Odiyal Kool At Home (Spicy Seafood Soup),"Take the brown rice and wash it thoroughly. Boil the brown rice and keep it aside for final preparation. Clean, rinse, and cut the fish, cuttlefish/squid, prawns/shrimps, and crabs. (Refer Note 1) Rinse and cut the jackfruit seeds, long beans, and tapioca. Get ready with thin tamarind juice and water. (Refer Note 2) Get ready with Odiyal flour, dried red chilies, salt, and turmeric powder. Wash the odiyal flour 2 or 3 times thoroughly before mix it to the Jaffna odiyal kool. Grind the dried red chilies to flakes. (Refer Note 3) Once you have done with all the preparations, place a large cooking pot over the stove. Add the pieces of fish, squid/cuttlefish, prawns/shrimps, and crabs. Now add turmeric powder and salt. Add all the water and mix everything well. Now switch on the flame. Cook covered under the high flame for 15 minutes. Take off the lid and mix everything well. Add the slices of tapioca and jackfruit seeds. Mix and cook covered again under the high flame for 15 minutes. Take off the lid and mash everything a little using a spoon especially the fish pieces. Cook uncovered under the high flame for 5 minutes. Now add long beans pieces and cook uncovered under the high flame for 2 minutes. Add the red chili flakes. (Refer Note 4) Add the thin tamarind juice. Add washed odiyal flour. Once you add odiyal flour, you should mix everything as soon as possible. If not the odiyal flour won’t mix up easily. Finally, add the boiled brown rice. Mix everything well and cook uncovered under medium flame for 5 minutes. Taste it and adjust salt, red chili flakes, tamarind juice if needed. Serve and enjoy this delicious spicy Jaffna odiyal kool or seafood soup in Sri Lankan style.",773.5,32.7,74.5,42.5,725.8
113,Fish Curry Without Tamarind And Chili Powder (Sprat Fish Sothi With Tomatoes),"Take the sprat fish and clean it carefully. Rinse it well at least 2 or 3 times and keep aside. Get ready with chopped onions, sliced green chilies, curry leaves, sliced tomatoes, turmeric powder, half of the lime, and salt. (Refer Note 1) Extract thin coconut milk from grated coconut and get ready with normal water. (Refer Note 2) Place the pan on top of the stove. Add well-cleaned sprat fishes, onions, curry leaves, green chilies, turmeric powder, and salt. Now add the water, mix everything and switch on the flame. Cook covered under the high flame for 3 to 5 minutes. Add the tomatoes and cook covered again under the high flame for 1 or 2 minutes. Now add the coconut milk and cook uncovered under medium flame for 2 to 4 minutes. During these 2 to 4 minutes, you will see the milk foams up occasionally. On those times you should stir constantly. Turn off the flame and add lime juice. Mix everything well and taste the curry. Adjust salt and lime if you need. Serve and enjoy this delicious Sri Lankan style fish curry without tamarind juice and chili powder.",975.5,27.9,137.8,46.5,557.7
114,Fish Curry Recipe Without Tomato And Oil (Healthy & Easy Cooking),"Take the pieces of fish and rinse it well at least 2 or 3 times. Here I used the pieces of Grey Mullet fish. Chop the onions, slice the green chilies, and slice the garlic cloves. Also, take fey curry leaves, turmeric powder, fenugreek seeds, salt, and curry powder. Keep everything aside. (Refer Note 1) Get ready with coconut milk and tamarind juice. (Refer Note 2) Place the cooking pan on the stove. Add turmeric powder, curry powder, salt, and fenugreek seeds. Also, add chopped onions, green chilies, garlic cloves, and curry leaves. Now add tamarind juice. Add the coconut milk. Mix everything and switch on the flame. Cook covered under the high flame for 6 to 8 minutes. Take off the lid, stir, and mix well. Stir gently, otherwise, the flesh part of the fish can easily rip off. Again cook covered under low flame for 5 to 7 minutes. (Refer Note 3) Take off the lid and taste the curry. Adjust salt and tamarind juice if needed. Serve and enjoy this Sri Lankan style easy fish curry recipe without tomato and cooking oil.",913.7,22.0,116.0,49.4,656.3
115,Easy Fish Egg Fry Recipe Sri Lankan | Grey Mullet Fish Egg Fry,"Take the fish egg and rinse it well. (Refer Note 1) Get ready with curry powder, turmeric powder, and salt. Place the cooking pan on the stove and place the fish egg carefully. Also, add salt, turmeric powder, curry powder, and water. Cook covered under the high flame for 6 to 8 minutes. Open the lid and flip the fish egg to the next side. Again cook covered under high flame until all the water disappears. (Refer Note 2) Now let them cool down. Now place the frying pan on the stove and carefully place the cooked fish eggs. Add some oil and let it fry under the low flame. Turn the fish eggs to every other side and let them fry. (Refer Note 3) Once done, carefully take them off to a nice and clean plate. Let them cool down. Now cut them into your desired size pieces. Decorate the plate with sliced onions, green chilies, and lime. If you want you can sprig some crushed black pepper and tomato sauce. Serve and enjoy this easy fish egg fry recipe in Sri Lankan style.",1256.5,23.1,85.0,101.0,555.0
116,Good Whole Roast Chicken Recipe Sri Lankan Style With Lime Garlic,"Take the whole chicken and rinse it well at least 2 or 3 times. Get ready with garlic paste, ginger paste, turmeric powder, Maggi chicken soup cube, salt, lime, chili powder, and butter. (Refer Note 1 and Note 2) Put the chicken in a large bowl. Add chili powder, garlic paste, ginger paste, turmeric powder, and salt. Paste everything inside and outside of the chicken using your fingers. Let it marinate for 2 to 3 hours. Heat the oil in a large frying pot and wait until the oil gets maximum heat. Now, carefully place the marinated whole chicken inside the oil. (Refer Note 3) Fry the chicken well. If you are using little oil, you should turn around and fry every little part of the chicken. At first, you can put the flame in high. But later turn the flame to medium. I used little cooking oil and for me, the frying process took about 15 minutes. Now grease the fried chicken with the lime. Just squeeze the lime and rub every outer part of the chicken. (Refer Note 4 and Note 5) After the lime, grease the chicken with Maggi chicken soup cube. Rub it with your fingers outside and inside of the chicken. Finally, do the same with butter. Paste the butter outside and inside of the chicken. Preheat the oven and place the chicken inside. Set the oven to 170 degree Celsius and 30 minutes on bake mode. Take off the chicken and place it on a plate. You can decorate the chicken with sliced onions and limes. Serve and enjoy this delicious whole roast chicken in Sri Lankan style.",1474.8,13.8,55.4,138.0,389.3
117,Whole Baby Squid Recipe | Spicy Baby Calamari Curry With Coconut,"Take the baby squids and rinse it well. Every baby squids have ink containers inside their body part. So, wash it carefully until removing all the black ink containers. (Refer Note 1) Chop the onions. Crush the garlic and ginger to paste. Get ready with curry leaves, salt, fenugreek seeds, turmeric powder, and curry powder. (Refer Note 2) Extract thin coconut milk from grated coconut and get ready with thin tamarind juice. (Refer Note 3) Heat the oil in the cooking pan. Add onions and sauté it until it gets soft and translucent. Add curry leaves and fenugreek seeds. Stir and cook until the onions turn into light golden color. Add ginger and garlic paste. Stir and cook for 30 seconds. Add the baby squids and mix everything well. (Refer Note 4) Cook covered under medium flame for 3 to 5 minutes. Take off the lid, stir and cook uncovered under medium flame until all the liquid disappears. For me, it takes about 2 minutes. Add turmeric powder, salt, and curry powder. Now add tamarind juice. Add coconut milk and mix everything well. Cook covered under the high flame for 3 to 5 minutes. Take off the lid, stir and mix everything. Again cook covered under low flame for 2 to 4 minutes. Taste the curry and adjust salt if needed. Serve and enjoy this Sri Lankan style spicy whole baby squid recipe with coconut milk.",1615.8,31.6,160.7,108.9,415.0
