recipe_id,title,instructions,calories,protein_g,carbs_g,fat_g,estimated_cost_lkr
167,Sri Lankan Mango Curry,"Cut mangoes in half (cut the seeds and the seed-shell as well). Discard the seed which is inside the seed-shell. Cut each half into 2 - 4 pieces depending on the size of the mangoes.  Add salt, turmeric powder and black pepper powder and mix well. Let the mango pieces marinate until you prepare other ingredients.The seed shell helps to keep the flesh intact otherwise the curry can turn mushy.; Cut mangoes in half (cut the seeds and the seed-shell as well). Discard the seed which is inside the seed-shell. Cut each half into 2 - 4 pieces depending on the size of the mangoes.  Add salt, turmeric powder and black pepper powder and mix well. Let the mango pieces marinate until you prepare other ingredients.; optional stepAdd cloves, cardamom, and Maldive fish chips to the mortar and pestle. Crush them until there aren't any large chunks left.You can make the spices into a powder too or leave them whole. I like to crush them a little bit so I don't bite into large chunks of spices or hard Maldive fish chips. Also the powdered spices are stronger than whole spices.; Add cloves, cardamom, and Maldive fish chips to the mortar and pestle. Crush them until there aren't any large chunks left.; Heat a large clay pot or a heavy bottom pot or a saucepan. Add oil and let the oil heat up. Add cinnamon, onion, garlic, curry leaves and pandan leaves. Saute. When garlic onion start to turn translucent, add the crushed spices and Maldive fish chips. Saute until garlic and onions turn brown.; Heat a large clay pot or a heavy bottom pot or a saucepan. Add oil and let the oil heat up. Add cinnamon, onion, garlic, curry leaves and pandan leaves. Saute. When garlic onion start to turn translucent, add the crushed spices and Maldive fish chips. Saute until garlic and onions turn brown.; Lower the heat. Add chili powder, roasted curry powder, and salt. Saute until the curry powder and chili powder starts to turn dark brown.Adding a little bit of salt along with chili powder reduces the amount of smoke it produces.; Lower the heat. Add chili powder, roasted curry powder, and salt. Saute until the curry powder and chili powder starts to turn dark brown.; Add the mango pieces. Mix well with all the ingredients that are in the pot.; Add the mango pieces. Mix well with all the ingredients that are in the pot.; Add water. Turn the heat to medium. Cook uncovered until water starts to simmer.; Add water. Turn the heat to medium. Cook uncovered until water starts to simmer.; When the water starts to simmer, lower the heat to medium to low, cover the pot with a lid, and cook for about 45 minutes - 1 hour until mango pieces are soft and tender. Add some water if you feel like the pot is drying out while cooking.; When the water starts to simmer, lower the heat to medium to low, cover the pot with a lid, and cook for about 45 minutes - 1 hour until mango pieces are soft and tender. Add some water if you feel like the pot is drying out while cooking.; When mango pieces are fully cooked and tender, add sugar and mix well. Taste and adjust salt if needed.; When mango pieces are fully cooked and tender, add sugar and mix well. Taste and adjust salt if needed.; Cook the curry uncovered until you get the desired thickness of gravy. Mango curry will turn darker in color as you cook it down.; Cook the curry uncovered until you get the desired thickness of gravy. Mango curry will turn darker in color as you cook it down.",0.0,0.0,0.0,0.0,63.9
168,Sri Lankan White Coconut Sambol,"In to the mortar and pestle, add peppercorns, salt, and Maldive fish chips. Pound them until they become a coarse powder or until no large pieces are left.; In to the mortar and pestle, add peppercorns, salt, and Maldive fish chips. Pound them until they become a coarse powder or until no large pieces are left.; Then add the chili peppers cut in halves (otherwise they can pop as you pound them), garlic, and curry leaves. Pound them until everything become a coarse paste.; Then add the chili peppers cut in halves (otherwise they can pop as you pound them), garlic, and curry leaves. Pound them until everything become a coarse paste.; Add chopped onions and grated coconut into the mortar. Pound them until everything is very well mixed together. You may have to mix it with a spoon a few times as well to make sure everything is well combined.; Add chopped onions and grated coconut into the mortar. Pound them until everything is very well mixed together. You may have to mix it with a spoon a few times as well to make sure everything is well combined.; Finally, add lime juice and more salt if needed. Pound again for a few seconds to mix. Taste and adjust seasonings to your liking.; Finally, add lime juice and more salt if needed. Pound again for a few seconds to mix. Taste and adjust seasonings to your liking.",0.0,0.0,0.0,0.0,63.9
169,Whole Wheat Sri Lankan Thati Paan,"Into the bowl of your stand mixer, warm milk, warm water, and instant yeast. Let it sit for a minute or two to see if the yeast forms tiny bubbles on the edges. Instant yeast doesn't need to be activated but this way you can confirm your yeast is good.If you're using active dry yeast, make sure to add the yeast to the warm milk and water mixture with a little bit of sugar and let it sit for about 10 minutes until yeast the mixture is nice and foamy. (don't add all the sugar as too much sugar can actually kill/slow down yeast); Into the bowl of your stand mixer, warm milk, warm water, and instant yeast. Let it sit for a minute or two to see if the yeast forms tiny bubbles on the edges. Instant yeast doesn't need to be activated but this way you can confirm your yeast is good.; Add butter, flour, and sugar—Knead to the mixer for 10 minutes. If kneading by hand, knead for about 20 minutes until the dough is very stretchy, soft, and pliable.; Add butter, flour, and sugar—Knead to the mixer for 10 minutes. If kneading by hand, knead for about 20 minutes until the dough is very stretchy, soft, and pliable.; Take the dough out of the mixer bowl, and shape it into a ball. Place it on the counter, cover it with a bowl, and let it double in size. This would take roughly an hour to 1.5 hours depending on your room temperature. Focus on the size of the dough rather than time.; Take the dough out of the mixer bowl, and shape it into a ball. Place it on the counter, cover it with a bowl, and let it double in size. This would take roughly an hour to 1.5 hours depending on your room temperature. Focus on the size of the dough rather than time.; When the dough has doubled in size, divide it into three equal pieces. Shape each dough piece into a ball. Cover the dough balls and let them rest for about 20 - 30 minutes.; When the dough has doubled in size, divide it into three equal pieces. Shape each dough piece into a ball. Cover the dough balls and let them rest for about 20 - 30 minutes.; Into a small cup/bowl, add oil and flour and mix it very well. Keep it aside.; Into a small cup/bowl, add oil and flour and mix it very well. Keep it aside.; Take one dough ball out. Flatten it out using your hands or a rolling pin into a rectangle. The width should be roughly equal to the width of your bread pan.Use your bread pan as a guideline.; Take one dough ball out. Flatten it out using your hands or a rolling pin into a rectangle. The width should be roughly equal to the width of your bread pan.Use your bread pan as a guideline.; Roll the rectangular dough from top to bottom, into a log. Pinch the ends to seal the edges.  Also, cover the inside of the loaf pans with butter or oil; Roll the rectangular dough from top to bottom, into a log. Pinch the ends to seal the edges.  Also, cover the inside of the loaf pans with butter or oil; Flatten the dough a little bit with your palms. Transfer the dough to the loaf pan, seam side down, and push it to one side. Apply the oil-flour mixture on the visible side so it's easier to separate bread.; Flatten the dough a little bit with your palms. Transfer the dough to the loaf pan, seam side down, and push it to one side. Apply the oil-flour mixture on the visible side so it's easier to separate bread.; Repeat the process for the other two dough balls as well. Make sure to apply the oil-flour mixture between each dough so they don't stick together. (please watch the video); Repeat the process for the other two dough balls as well. Make sure to apply the oil-flour mixture between each dough so they don't stick together. (please watch the video); Cover the loaf pan with plastic wrap and let it rise again until the dough has doubled in size. This would take roughly an hour - 1.5 hours depending on room temperature. Focus on the size of the dough, not the clock. Meanwhile make sure to preheat the oven to 400F/ 200C for about 20 mins.; Cover the loaf pan with plastic wrap and let it rise again until the dough has doubled in size. This would take roughly an hour - 1.5 hours depending on room temperature. Focus on the size of the dough, not the clock. Meanwhile make sure to preheat the oven to 400F/ 200C for about 20 mins.; When they have properly risen, spray (or brush if you don’t have a spray) some water on the top of the bread. This will help the bread to rise better in the oven and make the top crusty.; When they have properly risen, spray (or brush if you don’t have a spray) some water on the top of the bread. This will help the bread to rise better in the oven and make the top crusty.; Bake them in the oven for about 30 - 40 mins. This time varies from oven to oven. If you’re using a smaller convectional oven there is a chance that your bread browns quicker. Check on your bread after about 20 mins. If they seem to brown too quickly, transfer them to a lower rack and reduce the temperature a little bit or cover it with a piece of foil.; Bake them in the oven for about 30 - 40 mins. This time varies from oven to oven. If you’re using a smaller convectional oven there is a chance that your bread browns quicker. Check on your bread after about 20 mins. If they seem to brown too quickly, transfer them to a lower rack and reduce the temperature a little bit or cover it with a piece of foil.; Separate each Thati paan carefully and lay them on a baking sheet. Turn on the broiler setting in the oven. Apply melted/softened butter or coconut oil on one side first. Then broil for about a minute or two until they get nice and brown. Keep watching as you broil them cause they can go from toasted to burnt very quickly.; Separate each Thati paan carefully and lay them on a baking sheet. Turn on the broiler setting in the oven. Apply melted/softened butter or coconut oil on one side first. Then broil for about a minute or two until they get nice and brown. Keep watching as you broil them cause they can go from toasted to burnt very quickly.; Then turn the other side. Apply butter or coconut oil and broil again until nice and brown. Let the bread cool down on a cooling rack for a while before you cut them. So the crumbs can settle in.; Then turn the other side. Apply butter or coconut oil and broil again until nice and brown. Let the bread cool down on a cooling rack for a while before you cut them. So the crumbs can settle in.",0.0,0.0,0.0,0.0,4.7
170,Sri Lankan Malay Pickle,"Add chopped dates (in the sauce section in the ingredient list) into a bowl and add 1 1/2 cups vinegar.; Add chopped dates (in the sauce section in the ingredient list) into a bowl and add 1 1/2 cups vinegar.; Add mustard seeds and 2 tbsp of vinegar to the mortar and pestle (or to a small bowl).  Let both dates and mustard seeds soak for about 2 hours or at least until you ready your other ingredients.; Add mustard seeds and 2 tbsp of vinegar to the mortar and pestle (or to a small bowl).  Let both dates and mustard seeds soak for about 2 hours or at least until you ready your other ingredients.; after 2 hours, grind the mustard in the mortar and pestle until it's creamy. You can use a small grinder for this as well. But I notice that they become creamier when you do it in mortar and pestle.; after 2 hours, grind the mustard in the mortar and pestle until it's creamy. You can use a small grinder for this as well. But I notice that they become creamier when you do it in mortar and pestle.; Into your blender, add the dates along with the vinegar that you used to soak them earlier, garlic, ginger, chili powder, cinnamon powder, and 1 tsp of salt. (you can adjust the salt later)*Blend it until the mixture is smooth and doesn't have any solid pieces.some people also like to add a small piece of lime pickle (lunu dehi) when making this sauce. I usually omit this. You can add if you like the taste.; Into your blender, add the dates along with the vinegar that you used to soak them earlier, garlic, ginger, chili powder, cinnamon powder, and 1 tsp of salt. (you can adjust the salt later)*; Blend it until the mixture is smooth and doesn't have any solid pieces.; Add the blended mixture to a large clay pot or to a Dutch oven. Also, add ground mustard seeds and dark brown sugar. Mix and taste. Add the rest of the vinegar and salt, little by little, to balance the sweetness of the mixture. If the sauce is too sweet, add a little vinegar; if you got it too vinegary, add a little bit of brown sugar.; Add the blended mixture to a large clay pot or to a Dutch oven. Also, add ground mustard seeds and dark brown sugar. Mix and taste. Add the rest of the vinegar and salt, little by little, to balance the sweetness of the mixture. If the sauce is too sweet, add a little vinegar; if you got it too vinegary, add a little bit of brown sugar.; Bring the sauce to a simmer or until it bubbles slowly on the surface. Turn off the heat and let it cool down for about 5 - 10 minutes.Some people like to skip the cooking part and directly mix the vegetables with blended sauce. This way you can preserve the color of vegetables a little bit better. But heating the sauce makes the raw garlic and ginger flavor goes away and flavors meld better together. Either way is fine.; Bring the sauce to a simmer or until it bubbles slowly on the surface. Turn off the heat and let it cool down for about 5 - 10 minutes.; Mix carrots, shallots, banana peppers, green chilies and chopped dates with the sauce.; Mix carrots, shallots, banana peppers, green chilies and chopped dates with the sauce.; Let it cool down. Cover and let it sit overnight for the vegetables to soften and for flavors to develop. The next day you'd see that vegetables have oozed out more liquid and that your sauce has thinned out. This is totally fine. Give it a good mix before you serve. Store leftovers in a sterile jar.; Let it cool down. Cover and let it sit overnight for the vegetables to soften and for flavors to develop. The next day you'd see that vegetables have oozed out more liquid and that your sauce has thinned out. This is totally fine. Give it a good mix before you serve. Store leftovers in a sterile jar.",0.0,0.0,0.0,0.0,63.9
171,Sri Lankan Seeni Sambol,"Add tamarind and warm water into a small bowl. Set it aside to soak.; Add tamarind and warm water into a small bowl. Set it aside to soak.; Thinly slice onions. Add them to a large mixing bowl. Add chili flakes, chili powder, and turmeric powder to the bowl. Mix well with onions.; Thinly slice onions. Add them to a large mixing bowl. Add chili flakes, chili powder, and turmeric powder to the bowl. Mix well with onions.; Squeeze tamarind in warm water using your fingers to make it a thick saucy pulp. Discard any seeds and skin.; Squeeze tamarind in warm water using your fingers to make it a thick saucy pulp. Discard any seeds and skin.; Heat a large saute pan or a wok and add oil to it. When the oil starts to heat up, add cinnamon sticks, cardamom, and cloves. Let them heat in oil for a few seconds. Then add curry leaves and pandan leaves. (Be careful. Curry leaves and pandan leaves splatter in oil. You can close the pan with a lid for a few seconds for this); Heat a large saute pan or a wok and add oil to it. When the oil starts to heat up, add cinnamon sticks, cardamom, and cloves. Let them heat in oil for a few seconds. Then add curry leaves and pandan leaves. (Be careful. Curry leaves and pandan leaves splatter in oil. You can close the pan with a lid for a few seconds for this); Add onions and saute until onions become wilted. Then add salt, mix, and cook until there's no moisture left in the pan. Mix from time to time to avoid the bottom layer of onions from burning.; Add onions and saute until onions become wilted. Then add salt, mix, and cook until there's no moisture left in the pan. Mix from time to time to avoid the bottom layer of onions from burning.; Add tamarind pulp. Mix well with onions. Cook on medium-low heat, uncovered until onions are jammy in texture and some onion slices are caramelized.; Add tamarind pulp. Mix well with onions. Cook on medium-low heat, uncovered until onions are jammy in texture and some onion slices are caramelized.; Add sugar. Start with a little bit and increase until the onions are not sour in taste. Sourness should be balanced with sweetness. If the Seeni sambol is too sour, add more sugar. If it's too sweet, add a little bit of tamarind. Also adjust salt if needed.; Add sugar. Start with a little bit and increase until the onions are not sour in taste. Sourness should be balanced with sweetness. If the Seeni sambol is too sour, add more sugar. If it's too sweet, add a little bit of tamarind. Also adjust salt if needed.; Saute and cook until the onions are darker in color and jammy in texture. You can stop the cooking process at any point you like. More moisture you remove from the onions more time it'd last without going bad.; Saute and cook until the onions are darker in color and jammy in texture. You can stop the cooking process at any point you like. More moisture you remove from the onions more time it'd last without going bad.; Let the Seeni Sambol cool completely before storing it. Make sure to discard whole spices and pandan leaves before serving. Check the description for serving ideas.; Let the Seeni Sambol cool completely before storing it. Make sure to discard whole spices and pandan leaves before serving. Check the description for serving ideas.",0.0,0.0,0.0,0.0,63.9
172,Green Bean and Potato Curry,"Cut green beans into long (2 inch roughly) slices. Cut the potatoes into thin slices as well. They both should have roughly the same thickness.; Cut green beans into long (2 inch roughly) slices. Cut the potatoes into thin slices as well. They both should have roughly the same thickness.; Add everything into a deep pot except for a few curry leaves and, thick coconut milk. Mix well.; Add everything into a deep pot except for a few curry leaves and, thick coconut milk. Mix well.; Put on the stove and cook on medium heat until coconut milk starts to simmer.; Put on the stove and cook on medium heat until coconut milk starts to simmer.; Then turn the heat to low. Put the lid on the top of the pot but leave some space so the steam can escape. Cook until potatoes are about 90% cooked. Make sure to mix from time to time to stop the curry from bubbling and spilling over.; Then turn the heat to low. Put the lid on the top of the pot but leave some space so the steam can escape. Cook until potatoes are about 90% cooked. Make sure to mix from time to time to stop the curry from bubbling and spilling over.; Then add thick coconut milk, curry leaves (break them to release more aroma) and mix gently with everything else. Once the curry starts to simmer, turn off the heat.; Then add thick coconut milk, curry leaves (break them to release more aroma) and mix gently with everything else. Once the curry starts to simmer, turn off the heat.; optional stepServe with another tangy/citrusy dish to cut through the creaminess (read the serving ideas part in description). If you're serving the curry alone with rice, you can add a few drops of lime juice to the curry to bring some freshness to it.; Serve with another tangy/citrusy dish to cut through the creaminess (read the serving ideas part in description). If you're serving the curry alone with rice, you can add a few drops of lime juice to the curry to bring some freshness to it.",0.0,0.0,0.0,0.0,63.9
173,Sri Lankan Gotu Kola Sambol,"Wash and clean Gotu kola. Dry them off using a salad spinner. Or leave them in a colander to drain all water out. Make the leaves and stalks into a bundle and slice them thinly. Make sure to use a sharp knife so you won't bruise the leaves. (You can cut them into thicker slices too); Wash and clean Gotu kola. Dry them off using a salad spinner. Or leave them in a colander to drain all water out. Make the leaves and stalks into a bundle and slice them thinly. Make sure to use a sharp knife so you won't bruise the leaves. (You can cut them into thicker slices too); Into a bowl, add coconut, onions, green chili, black pepper, salt, Maldive fish chips, and lime juice. Mix very well with your fingers (wear gloves).; Into a bowl, add coconut, onions, green chili, black pepper, salt, Maldive fish chips, and lime juice. Mix very well with your fingers (wear gloves).; Then add chopped Gotu kola leaves and tomato. Mix gently but thoroughly without bruising the leaves.  Adjust salt and lime to your taste.; Then add chopped Gotu kola leaves and tomato. Mix gently but thoroughly without bruising the leaves.  Adjust salt and lime to your taste.",0.0,0.0,0.0,0.0,63.9
174,Sri Lankan Vegetable Soup,"Heat a soup pot and add butter into it. Keep the heat medium. Add garlic and and curry leaves. Sauté until garlic turns soft. (curry leaves splatter when added to hot butter. be careful); Heat a soup pot and add butter into it. Keep the heat medium. Add garlic and and curry leaves. Sauté until garlic turns soft. (curry leaves splatter when added to hot butter. be careful); Add carrot, leeks, celery and cabbage (sliced green bean is also a common vegetable that you can add). Also add salt (do not add too much as many broths contain salt). Sauté until leeks turns wilted and soft.; Add carrot, leeks, celery and cabbage (sliced green bean is also a common vegetable that you can add). Also add salt (do not add too much as many broths contain salt). Sauté until leeks turns wilted and soft.; Then add potatoes, tomatoes and red lentils. Sauté for about a minute. Add the broth. Mix everything. Cover and simmer until all the potatoes are fully cooked and mashable. Turn off the heat.; Then add potatoes, tomatoes and red lentils. Sauté for about a minute. Add the broth. Mix everything. Cover and simmer until all the potatoes are fully cooked and mashable. Turn off the heat.; Now using an emersion blender, blend the soup until about half of the vegetable pieces are blended*. (Or you can transfer half of the soup to a regular blender and blend it); Now using an emersion blender, blend the soup until about half of the vegetable pieces are blended*. (Or you can transfer half of the soup to a regular blender and blend it); Turn the heat back on and bring the soup to simmer. Add noodles. Cook until noodles are about 80% cooked (it will continue to cook with the residual heat). Add black pepper and turn off the heat. Adjust salt if necessary.; Turn the heat back on and bring the soup to simmer. Add noodles. Cook until noodles are about 80% cooked (it will continue to cook with the residual heat). Add black pepper and turn off the heat. Adjust salt if necessary.",0.0,0.0,0.0,0.0,38.7
175,Sri Lankan Devilled Shrimp,"Marinate shrimp with salt, black pepper, and lime juice. Set it aside for 15 mins.; Marinate shrimp with salt, black pepper, and lime juice. Set it aside for 15 mins.; Mix water and cornstarch together in a small bowl. Add ketchup, soy sauce, and sugar to it and mix well to combine. Set aside.; Mix water and cornstarch together in a small bowl. Add ketchup, soy sauce, and sugar to it and mix well to combine. Set aside.; Heat a wok/ large saute pan to high heat. Add oil let the oil heat up. Add shrimp to the pan and fry on high heat until shrimp are completely cooked (no raw parts visible).; Heat a wok/ large saute pan to high heat. Add oil let the oil heat up. Add shrimp to the pan and fry on high heat until shrimp are completely cooked (no raw parts visible).; Turn off the heat. Using a slotted spoon, drain and remove shrimp from the pan to a separate clean plate. (If there's any juice left in the pan, turn the heat back on and let the liquid evaporate. ); Turn off the heat. Using a slotted spoon, drain and remove shrimp from the pan to a separate clean plate. (If there's any juice left in the pan, turn the heat back on and let the liquid evaporate. ); Turn the heat to medium. Add another 1 tbsp of oil (you can skip adding extra oil if your pan already has enough oil left from frying shrimp). Add ginger and garlic. Saute until garlic turns light brown on the edges.; Turn the heat to medium. Add another 1 tbsp of oil (you can skip adding extra oil if your pan already has enough oil left from frying shrimp). Add ginger and garlic. Saute until garlic turns light brown on the edges.; Then add chili flakes and Sri Lankan-Chinese chili paste. Saute for a few seconds.; Then add chili flakes and Sri Lankan-Chinese chili paste. Saute for a few seconds.; Add shrimp, onions, and peppers to the pan and mix until all the shrimp are coated with chili flakes.; Add shrimp, onions, and peppers to the pan and mix until all the shrimp are coated with chili flakes.; Lower the heat. Add the sauce. Mix well to coat everything with the sauce; Lower the heat. Add the sauce. Mix well to coat everything with the sauce; Finally, add tomatoes. Gently mix with shrimp.; Finally, add tomatoes. Gently mix with shrimp.",0.0,0.0,0.0,0.0,63.9
